302.0,Private,Oriental University,"Opp. Rewati Range Gate No. 1, Post Shri Aurobindo, Jakhya, IndorePost Aurobindo, Sanwer Road, Jakhya, Indore, District nan, Madhya Pradesh",453555.0,Madhya Pradesh,2(f),Private Uni.csv,,,,,,,,,,Private_496,22.8031908,75.8563922,80,2,1.0,google
303.0,Private,P. P. Savani University,"NH 8, GETCO, Near BiltechVillage Dhamdod, Kosamba, Ta. Mangrol, District Surat, District nan, Gujarat",394125.0,Gujarat,2(f),Private Uni.csv,,,,,,,,,,Private_497,21.4986405,73.0015366,80,2,0.6,google
304.0,Private,P.K. University,"Village age - Thanra, Tehsil - Karera, NH-27, District rict - Shivpuri, District nan, Madhya Pradesh",473665.0,Madhya Pradesh,2(f),Private Uni.csv,,,,,,,,,,Private_498,25.4664902,78.2860054,80,2,0.8500000000000001,google
305.0,Private,Pacific Academy of Higher Education  & Research (PAHER),"Airport Road, Pratap Nagar ExtensionDebari, UdaipurNULL, District nan, Rajasthan",,Rajasthan,2(f),Private Uni.csv,,,,,,,,,,Private_499,24.5906197,73.7488946,80,2,0.8500000000000001,google
306.0,Private,Pacific Medical University,"Bhilo ka Bedla, ByepassNH - 27, Udiapur, District nan, Rajasthan",,Rajasthan,2(f),Private Uni.csv,,,,,,,,,,Private_500,24.6560093,73.6975421,80,2,0.8500000000000001,google
307.0,Private,Pandit Deendayal Energy University (Formerly Pandit Deendayal Petroleum University),"Knowledge Corridor, Raisan Village age, Gandhinagar, District nan, Gujarat",382007.0,Gujarat,2(f),Private Uni.csv,,,,,,,,,,Private_501,23.1604702,72.6357312,80,2,0.8,google
309.0,Private,PDM University,"Post Box No.-15, Sector-3A, Sarai Aurangabad, BahadurgarhHaryana, District nan",124507.0,Haryana,2(f),Private Uni.csv,,,,,,,,,,Private_503,28.6865392,76.9001986,80,2,0.6,google
310.0,Private,People's University,"Peoples Campus, Bhanpur, BhopalM.P, District nan, Madhya Pradesh",462037.0,Madhya Pradesh,2(f),Private Uni.csv,,,,,,,,,,Private_504,23.3025413,77.4228625,80,2,0.6,google
311.0,Private,PES University,"100 Feet Ring Road, BSK III Stage, Bangalore, District nan, Karnataka",560085.0,Karnataka,2(f),Private Uni.csv,,,,,,,,,,Private_505,12.9243968,77.6481229,80,2,0.8500000000000001,google
312.0,Private,Pimpri Chinchwad University,"Gut No-44, 46, 48, 49 and 50, Sate Taluka uka Maval, District rict-Pune, District nan, Maharashtra",412206.0,Maharashtra,2(f),Private Uni.csv,,,,,,,,,,Private_506,18.7438785,73.5984261,80,2,0.6,google
313.0,Private,Plaksha University,"Punjab, Block B, Sector-101, Alpha, IT CIty, SAS NagarMohali, District nan",140306.0,Punjab,2(f),Private Uni.csv,,,,,,,,,,Private_507,30.6255225,76.7174907,80,2,0.8,google
314.0,Private,Plastindia International University,"Dungra, GIDC, Vapi, District -Valsad, District nan, Gujarat",396195.0,Gujarat,2(f),Private Uni.csv,,,,,,,,,,Private_508,20.3634554,72.94015089999999,80,2,0.6,google
299.0,Private,O.P. Jindal University,"OP Jindal Knoledge Park, Punjipathra, RaigarhGharghoda Road Punjipathra, Raigarh, District nan, Chhattisgarh",496109.0,Chhattisgarh,2(f),Private Uni.csv,,,,,,,,,,Private_493,21.9289368,83.3571173,80,2,0.8,google
315.0,Private,Poornima University,"IS-2027-31, Post Office -Vidhani Vatika, Ramchandrapura, Sitapura Extension, JaipurJaipur, Rajasthan, District nan",303905.0,Rajasthan,2(f) & 12(B),Private Uni.csv,,,,,,,,,,Private_509,26.7477111,75.8208765,80,2,0.8500000000000001,google
283.0,Private,Monad University,"Monad University Campus. N.H. 9, Delhi Hapur Road, Village age Post Kastla, Kasmabad, Pilkhuwa, District t. Hapur, District nan, Uttar Pradesh",245101.0,Uttar Pradesh,2(f),Private Uni.csv,,,,,,,,,,Private_477,28.7179205,77.7079604,80,2,0.8500000000000001,google
281.0,Private,Mohammad Ali Jauhar University,"Jauhar Nagar Sigan Khera Rampur U.Post Box lock Saidnagar, District t. Rampur, District nan, Uttar Pradesh",244927.0,Uttar Pradesh,2(f),Private Uni.csv,,,,,,,,,,Private_475,28.9044518,79.0045014,80,2,0.8500000000000001,google
248.0,Private,Maharishi University of Management and Technology,"Maharishi Road, Post Box No. - 10, Mangla, Bilaspur, District nan, Chhattisgarh",,Chhattisgarh,2(f),Private Uni.csv,,,,,,,,,,Private_442,22.097191,82.1293881,80,2,0.6,google
249.0,Private,Mahatama Gandhi University,"13th Mile, G S RoadKanapara, District t. Ri-Bhoi, District nan, Meghalaya",793101.0,Meghalaya,2(f),Private Uni.csv,,,,,,,,,,Private_443,26.07502,91.87548989999999,80,2,0.8,google
250.0,Private,Mahatma Gandhi University of Medical Sciences & Technology,"RIICO Institutional Area, Sitapur, Tonk Road, Jaipur-302 022 Rajasthan, District nan",,Rajasthan,2(f),Private Uni.csv,,,,,,,,,,Private_444,26.8888384,75.80356669999999,80,2,1.0,google
251.0,Private,Mahatma Jyoti Rao Phoole University,"SP-2 3, Kant Kalwar, RIICO Industrial Area, NH-8 Near Achrol, Jaipur, District nan, Rajasthan",,Rajasthan,2(f),Private Uni.csv,,,,,,,,,,Private_445,27.3752716,75.9554188,80,2,0.8500000000000001,google
252.0,Private,Mahaveer University,"Pohali, Sardhana Road, Meerut, District nan, Uttar Pradesh",250341.0,Uttar Pradesh,2(f),Private Uni.csv,,,,,,,,,,Private_446,29.0640622,77.635035,80,2,0.8500000000000001,google
253.0,Private,Mahayogi Gorakhnath University Gorakhpur,"Arogya Dham, Balapur Road, Sonbarsa, District t-Gorakhpur, District nan, Uttar Pradesh",237007.0,Uttar Pradesh,2(f),Private Uni.csv,,,,,,,,,,Private_447,26.8386801,83.3655823,80,2,0.6,google
254.0,Private,Mahindra University,"At Bahadurpally V, Qudbullapur Mandal, Madchal Malkajgiri, District nan, Telangana",,Telangana,2(f),Private Uni.csv,,,,,,,,,,Private_448,17.5641438,78.4376862,80,2,0.6,google
255.0,Private,Major S. D. Singh University,"Bhojpur, Kanpur Road, Fatehgarh, Farrukhabad, District nan, Uttar Pradesh",209749.0,Uttar Pradesh,2(f),Private Uni.csv,,,,,,,,,,Private_449,27.3592997,79.6295384,80,2,0.8500000000000001,google
256.0,Private,Malla Reddy University,"Maisammaguda, Dhulapally, Post via Kompally, Medchal- Malkajgiri District rict, District nan, Telangana",500014.0,Telangana,2(f),Private Uni.csv,,,,,,,,,,Private_450,17.5630979,78.4553013,80,2,0.6,google
257.0,Private,Malwanchal University,"Index City, NH-59A, Nemawar Road, Near Khundel, District rict-Indore, District nan, Madhya Pradesh",452016.0,Madhya Pradesh,2(f),Private Uni.csv,,,,,,,,,,Private_451,22.6900588,75.88366239999999,80,2,1.0,google
258.0,Private,Manav Bharti University,"Village age - Laddo, Post OfficeSultanpur, Tehsil sil District t, Solan, District nan, Himachal Pradesh",,Himachal Pradesh,2(f),Private Uni.csv,,,,,,,,,,Private_452,30.8627986,77.09674059999999,80,2,0.8,google
259.0,Private,Manav Rachna University,"Sector-43, Aravalli Hills, Delhi-Surajkund Road, FaridabadDelhi-Surajkund Road, Faridabad, District nan, Haryana",121001.0,Haryana,2(f),Private Uni.csv,,,,,,,,,,Private_453,28.4493906,77.2841637,80,2,0.8500000000000001,google
260.0,Private,Mandsaur University,"Mahow Neemuch bypass, Rewas Devda, Road, MandsaurSh-31, Mandsaur, District nan, Madhya Pradesh",458001.0,Madhya Pradesh,2(f),Private Uni.csv,,,,,,,,,,Private_454,24.0742858,75.031408,80,2,0.8,google
261.0,Private,Mangalayatan University,"NH-30, Mandla Road, Near Shrda Devi Mandir, Richai-Barela, Jabalpur, District nan, Madhya Pradesh",483001.0,Madhya Pradesh,2(f),Private Uni.csv,,,,,,,,,,Private_455,23.1410831,79.8795952,80,2,0.8,google
282.0,Private,Mohan Babu University,"Sree Sainath Nagar, Tirupati, District nan, Andhra Pradesh",517102.0,Andhra Pradesh,2(f),Private Uni.csv,,,,,,,,,,Private_476,13.6203917,79.2891786,80,2,1.0,google
262.0,Private,Mangalayatan University,"Extended NCR, 33rd MilestoneMathura-Aligarh HighwayBeswan Aligarh, District nan, Uttar Pradesh",,Uttar Pradesh,2(f),Private Uni.csv,,,,,,,,,,Private_456,27.8973944,78.0880129,80,2,0.6,google
264.0,Private,Manipur International University,"MIU Place, Ghari, Airport RoadImphal, District nan, Manipur",795140.0,Manipur,2(f),Private Uni.csv,,,,,,,,,,Private_458,24.7784408,93.9084798,80,2,1.0,google
265.0,Private,Mansarovar Global University,"Village age Gadia and Ratnakhedi, Block-BilkisganjSehore, District nan, Madhya Pradesh",,Madhya Pradesh,2(f),Private Uni.csv,,,,,,,,,,Private_459,23.1452228,75.7226116,80,2,0.6,google
267.0,Private,Marwadi University,"Rajkot- Morbi HIghway, Near Gauridad, RajkotRajkot, District nan, Gujarat",360003.0,Gujarat,2(f),Private Uni.csv,,,,,,,,,,Private_461,22.3950661,70.7950708,80,2,0.8500000000000001,google
268.0,Private,Mata Gujri University,"Purabpali Roa, Kishangunj, District nan, Bihar",855107.0,Bihar,2(f),Private Uni.csv,,,,,,,,,,Private_462,26.3077923,87.77633329999999,80,2,0.6,google
269.0,Private,MATS University,"Aarang Kharora Highway, Aarang, District rict Raipur, District nan, Chhattisgarh",493441.0,Chhattisgarh,2(f),Private Uni.csv,,,,,,,,,,Private_463,21.2768857,82.0252865,80,2,0.8500000000000001,google
271.0,Private,Maya Devi University,"NH-72, Near Hotel The Competent Palace, Central Hope Town Selaqui, Chakrata Road, Dehradun, District nan, Uttarakhand",248011.0,Uttarakhand,2(f),Private Uni.csv,,,,,,,,,,Private_465,30.3585135,77.8489132,80,2,0.8,google
272.0,Private,"Medhavi Skills University, Sikkim","Singtam Campus TopakhaniLower Chisopani, Singtam Bazar, SingtamDist.- East Sikkim, District nan",737134.0,Sikkim,2(f),Private Uni.csv,,,,,,,,,,Private_466,27.2346549,88.5045745,80,2,0.8500000000000001,google
273.0,Private,Medi-Caps University,"A B Road, Pigdamber, Rau, IndorePigdamber, RauIndore, District nan, Madhya Pradesh",453331.0,Madhya Pradesh,2(f),Private Uni.csv,,,,,,,,,,Private_467,22.6375985,75.8117791,80,2,0.8500000000000001,google
274.0,Private,Mewar University,"NH - 79 Gangrar, Chittorgarh, District nan, Rajasthan",,Rajasthan,2(f) & 12(B),Private Uni.csv,,,,,,,,,,Private_468,25.0610679,74.6239764,80,2,0.6,google
275.0,Private,MGM University,"MGM CampusN-6, CIDCO, Aurangabad, District nan, Maharashtra",431003.0,Maharashtra,2(f),Private Uni.csv,,,,,,,,,,Private_469,19.8796875,75.3585481,80,2,1.0,google
277.0,Private,MIT Art Design and Technology University,"Rajbaug, Pune Solapur Highway, next to HadapsarNext to Hadapsar, Loni Kalbhor, Pune, District nan, Maharashtra",412201.0,Maharashtra,2(f),Private Uni.csv,,,,,,,,,,Private_471,18.491911,74.023716,80,2,0.8,google
278.0,Private,"MIT Vishwaprayag University, Solapur","Village age Kegaon, Solapur-Pune Highway, Taluka uka North Solapur, District rict Solapur, District nan, Maharashtra",413255.0,Maharashtra,2(f),Private Uni.csv,,,,,,,,,,Private_472,17.6919519,75.8821982,80,2,0.8500000000000001,google
279.0,Private,MNR University,"MNR Nagar, Fasalwadi, Sangareddy, Gr. Hyderabad, District nan, Telangana",502294.0,Telangana,2(f),Private Uni.csv,,,,,,,,,,Private_473,17.6408582,78.1236485,80,2,0.8,google
280.0,Private,Mody University of Science & Technology,"LaxmangarhDistrict - SikarRajasthan, District nan",332311.0,Rajasthan,2(f) & 12(B),Private Uni.csv,,,,,,,,,,Private_474,27.6093912,75.1397935,80,2,0.6,google
9.0,Central,Central University of Gujarat,"Near Jalaram Temple, Sector 29, Gandhinagar, District nan, Gujarat",382030.0,Gujarat,2(f) & 12(B),Central Uni.csv,,,,,,,,,,Central_8,23.244022,72.6629234,80,2,0.8,google
113.0,Private,Dr K N Modi University,"NewaiArea ph-II, Post Box No.01, Newai, District t. Tonk, Rajasthan, District nan",304021.0,Rajasthan,2(f),Private Uni.csv,,,,,,,,,,Private_307,26.4588871,75.9424082,80,2,1.0,google
316.0,Private,Pragjyotishpur University,"Hajongbari, Post Office - Chandrapur, Kamrup, Metropolitan District rict, Guwahati, District nan, Assam",781050.0,Assam,2(f),Private Uni.csv,,,,,,,,,,Private_510,26.2249826,91.89866789999999,80,2,0.8,google
320.0,Private,Prestige University,"Gram Ringnodia, Indore-Ujjain, Indore, District nan, Madhya Pradesh",453551.0,Madhya Pradesh,2(f),Private Uni.csv,,,,,,,,,,Private_514,22.6986266,75.9071603,80,2,1.0,google
354.0,Private,Sanjeev Agrawal Global Educational University,"Katara Extension, Sahara Bypass Road, Bhopal, District nan, Madhya Pradesh",,Madhya Pradesh,2(f),Private Uni.csv,,,,,,,,,,Private_548,23.1867965,77.5176844,80,2,0.8,google
355.0,Private,Sanjivani University,"Gat No. 24 and 25, Kopargaon, Taluka uka Kopargaon, District rict-Ahmednagar, District nan, Maharashtra",423601.0,Maharashtra,2(f),Private Uni.csv,,,,,,,,,,Private_549,19.8848736,74.4727826,80,2,0.6,google
357.0,Private,Sanskaram University,"Village age-Kheri Taluka uka, Patauda, District rict-Jhajjar, District nan, Haryana",124108.0,Haryana,2(f),Private Uni.csv,,,,,,,,,,Private_551,28.4031325,76.6773655,80,2,0.6,google
358.0,Private,Sanskriti University,"28 KM STONE MATHURA DELHI HIGHWAY CHHATA MATHURA UPMathura-Delhi Highway, Chhata, Mathura, District nan, Uttar Pradesh",281401.0,Uttar Pradesh,2(f),Private Uni.csv,,,,,,,,,,Private_552,27.8332867,77.417722,80,2,0.8,google
359.0,Private,Sant Baba Bhag Singh University,"Village age Khiala, Post Office Padhiana, Diatt Jalandhar, PunjabPO-PadhianaDist-Jalandhar, District nan",144030.0,Punjab,2(f),Private Uni.csv,,,,,,,,,,Private_553,31.4087001,75.8054552,80,2,0.6,google
360.0,Private,Sapthagiri NPS University,"145, Chikkasandra, Hesaraghatta main road, Bengaluru, District nan, Karnataka",550057.0,Karnataka,2(f),Private Uni.csv,,,,,,,,,,Private_554,13.0943011,77.4880275,80,2,0.8500000000000001,google
361.0,Private,Sardar Bhagwan Singh University,"Balawala, Dehradun, UttrakhandDehradunUttarakhand, District nan",248001.0,Uttarakhand,2(f),Private Uni.csv,,,,,,,,,,Private_555,30.2661801,78.1062092,80,2,0.6,google
362.0,Private,Sardar Patel University,"SARDAR PATEL KNOWLEDGE CITY, DONGARIYA WARASEONI ROAD, Post Office ST-CHILLOD, TAHSIL-LALBURRA, DISTRICT-BALAGHATM.P.Waraseoni Road, DongariyaBalaghat, District nan, Madhya Pradesh",481331.0,Madhya Pradesh,2(f),Private Uni.csv,,,,,,,,,,Private_556,21.7649901,80.0490006,80,2,0.8500000000000001,google
363.0,Private,Sardar Vallabhbhai Global University,"Chimanbhai Patel Institute Campus, Opp, Karnavati Club, Ahmedabad, District nan, Gujarat",380015.0,Gujarat,2(f),Private Uni.csv,,,,,,,,,,Private_557,23.016735,72.50523299999999,80,2,1.0,google
364.0,Private,Sarla Birla University,"Birla Knowledge cityRanchi-purulia Highway, Ranchi, District nan, Jharkhand",835103.0,Jharkhand,2(f),Private Uni.csv,,,,,,,,,,Private_558,23.3618027,85.4250015,80,2,0.8500000000000001,google
365.0,Private,Sarvajanik University,"M.T.B. College Campus, Opposite Chowpati Athwalines, Surat, District nan, Gujarat",395001.0,Gujarat,2(f),Private Uni.csv,,,,,,,,,,Private_559,21.1817476,72.8076497,80,2,0.8,google
366.0,Private,Sarvepalli Radhakrishnan University,"NH-12, Hoshangabad RoadJatkhedi, Bhopal, District nan, Madhya Pradesh",,Madhya Pradesh,2(f),Private Uni.csv,,,,,,,,,,Private_560,23.1719292,77.4648184,80,2,1.0,google
367.0,Private,Saveetha Amaravati University,"3rd Floor, Vaishnavi ComplexOpp. Executive ClubVijayawada, District nan, Andhra Pradesh",520008.0,Andhra Pradesh,2(f),Private Uni.csv,,,,,,,,,,Private_561,15.9128998,79.7399875,80,2,0.6,google
368.0,Private,Scope Global Skills University,"Scope Campus, NH-12, Bhaironpur, Near Misrod, Hoshangabad Road, Bhopal, District nan, Madhya Pradesh",462026.0,Madhya Pradesh,2(f),Private Uni.csv,,,,,,,,,,Private_562,23.1577589,77.4722395,80,2,0.8500000000000001,google
353.0,Private,Sanjay Ghodawat University,"Ap. Atigre, Taluka Hatkangala, District KolhapurDist-Kolhapur, District nan, Maharashtra",416118.0,Maharashtra,2(f),Private Uni.csv,,,,,,,,,,Private_547,16.7413328,74.3675446,80,2,0.6,google
369.0,Private,SDGI Global University,"NH-9, Delhi-Hapur Road, Ghaziabad, Delhi-NCR, District nan, Uttar Pradesh",201015.0,Uttar Pradesh,2(f),Private Uni.csv,,,,,,,,,,Private_563,28.6409375,77.4105059,80,2,0.8500000000000001,google
371.0,Private,Sharda University,"Plot32, 34, Knowledge Park III, Greater NoidaGrerater Noida, District nan, Uttar Pradesh",201306.0,Uttar Pradesh,2(f),Private Uni.csv,,,,,,,,,,Private_565,28.4733144,77.4828948,80,2,1.0,google
372.0,Private,Sharda University Agra,"18 Km. Stone on Agra-Delhi Highway NH-19, Keetham, Agra, District nan, Uttar Pradesh",282007.0,Uttar Pradesh,2(f),Private Uni.csv,,,,,,,,,,Private_566,27.1919615,78.3430123,80,2,0.8500000000000001,google
373.0,Private,Sharnbasva University,"Kalaburgi Gulbarga, District nan, Karnataka",585103.0,Karnataka,2(f),Private Uni.csv,,,,,,,,,,Private_567,17.329731,76.8342957,80,2,0.6,google
374.0,Private,Shiv Nadar University,"Rajiv Gandhi SalaiOMRKalavakkam, District nan, Tamil Nadu",603110.0,Tamil Nadu,2(f),Private Uni.csv,,,,,,,,,,Private_568,11.1271225,78.6568942,80,2,0.6,google
375.0,Private,Shobhit University,"Adarsh Vijendra Institutional area Gangoh, Saharanpur U.Post Box abu Vijendra MargGangoh, District t.- Saharanpur, District nan, Uttar Pradesh",247341.0,Uttar Pradesh,2(f),Private Uni.csv,,,,,,,,,,Private_569,29.7788493,77.26063049999999,80,2,0.6,google
376.0,Private,Shoolini University of Biotechnology and Management Sciences,"Shoolini University, Village age - Bajhol, Post Office - Sultanpur, District rict - Solan, State - Himachal Pradesh, District nan",173229.0,Himachal Pradesh,2(f),Private Uni.csv,,,,,,,,,,Private_570,30.8627986,77.09674059999999,80,2,0.8,google
377.0,Private,Shree Guru Gobind Singh Tricentenary University,"Budhera, Gurugram - Badli Road, Gurugram HaryanaDistt., Gurgaon, Haryana - 122 505, District nan",122505.0,Haryana,2(f) & 12(B),Private Uni.csv,,,,,,,,,,Private_571,28.4918198,76.8880843,80,2,0.8500000000000001,google
378.0,Private,Shreyarth University,"Co Gujarat Samachar Bhavan, Khanpur, Ahmedabad, District nan",380001.0,Gujarat,2(f),Private Uni.csv,,,,,,,,,,Private_572,23.0299074,72.5803358,80,2,1.0,google
379.0,Private,Shri Davara University,"NH-30, Davara Educational Campus, Naya Raipur, District nan, Chhattisgarh",493661.0,Chhattisgarh,2(f),Private Uni.csv,,,,,,,,,,Private_573,21.2894931,81.6363893,80,2,0.8500000000000001,google
380.0,Private,Shri Dharmasthala Manjunatheshwara University,"Manjushree Nagar, Sattur, Dharwad- 09SDM College of Medical Sciences Hospital CampusSattur, Dharwad, District nan, Karnataka",580009.0,Karnataka,2(f),Private Uni.csv,,,,,,,,,,Private_574,15.4184029,75.045452,80,2,0.6,google
381.0,Private,Shri Guru Ram Rai University,"Patel NagarDehradun, District nan, Uttarakhand",,Uttarakhand,2(f),Private Uni.csv,,,,,,,,,,Private_575,30.066753,79.01929969999999,80,2,0.6,google
383.0,Private,Shri Kallaji Vedic Vishvavidyalaya,"Kamdhaj Nagar, Nimbahera, Chittorgarh, District nan, Rajasthan",,Rajasthan,2(f),Private Uni.csv,,,,,,,,,,Private_577,24.6239992,74.6892525,80,2,0.6,google
384.0,Private,Shri Khushal Das University,"7 STG, Suratgarh road, Hanumangarh Jn., Pilibangan, District nan, Rajasthan",335801.0,Rajasthan,2(f),Private Uni.csv,,,,,,,,,,Private_578,29.6090246,74.2811276,80,2,0.8500000000000001,google
385.0,Private,Shri Krishna University,"NH-86Villege Chauka Sagar Road Chhatarpur M.P.Village age Chowka, Sagar Road, Chhatarpur, District nan, Madhya Pradesh",471001.0,Madhya Pradesh,2(f),Private Uni.csv,,,,,,,,,,Private_579,24.8256372,79.5209994,80,2,0.6,google
370.0,Private,Seacom Skills University,"Village age-Kendradanga, Post Office - Sattore, PS - Panrui, District - Birbhum, District nan, West Bengal",731236.0,West Bengal,2(f),Private Uni.csv,,,,,,,,,,Private_564,23.7112552,87.6276616,80,2,0.8,google
317.0,Private,Pragyan International University,"Bariatu Road, Booty More, Post Office -RMCHRanchi, District nan, Jharkhand",834009.0,Jharkhand,2(f),Private Uni.csv,,,,,,,,,,Private_511,23.3440997,85.309562,80,2,0.8,google
352.0,Private,Sangam University,"NH.79, Bhilwara Chittor By PassChittor Road, Bhilwara, Rajasthan, District nan",311001.0,Rajasthan,2(f),Private Uni.csv,,,,,,,,,,Private_546,25.3013546,74.6350691,80,2,0.8500000000000001,google
350.0,Private,Sandip University,"Neelam Vidya Vihar, Village -Sijoul, District -Madhubani, District nan, Bihar",847235.0,Bihar,2(f),Private Uni.csv,,,,,,,,,,Private_544,26.3506102,86.2405787,80,2,0.8,google
5.0,Central,Central Agricultural University,"Lamphelpat, Imphal West, District nan, Manipur",795004.0,Manipur,2(f) & 12(B),Central Uni.csv,,,,,,,,,,Central_4,24.8236023,93.9113634,80,2,0.6,google
321.0,Private,Quantum University,"22km Milestone, Roorkee-Dehradun highway NH-73, Roorkee, District nan, Uttarakhand",247167.0,Uttarakhand,2(f),Private Uni.csv,,,,,,,,,,Private_515,29.9030454,77.84965749999999,80,2,0.8,google
322.0,Private,R.N.B. Global University,"RNB Global City Ganganagar RoadBikaner, District nan, Rajasthan",334601.0,Rajasthan,2(f),Private Uni.csv,,,,,,,,,,Private_516,28.0670038,73.3414053,80,2,0.8500000000000001,google
323.0,Private,Rabindranath Tagore University (formerly known as AISECT University),"Chiklod Road, Near Bangrasia Chouraha Bhopal, District nan, Madhya Pradesh",462047.0,Madhya Pradesh,2(f),Private Uni.csv,,,,,,,,,,Private_517,23.2510918,77.419058,80,2,0.8500000000000001,google
324.0,Private,Radha Govind University,"Radha Govind Nagar, Lalki GhatiLalki Ghati, Ramgarh-, District nan, Jharkhand",829122.0,Jharkhand,2(f),Private Uni.csv,,,,,,,,,,Private_518,23.5559428,85.5236208,80,2,0.8500000000000001,google
4.0,Central,Banaras Hindu University,"AjagaraVaranasi, District nan, Uttar Pradesh",221005.0,Uttar Pradesh,2(f) & 12(B),Central Uni.csv,,,,,,,,,,Central_3,25.269363,82.9924889,80,2,0.6,google
325.0,Private,Raffles University,"Japanese Zone, NH-48, Neemrana, Alwar, RajasthanDistrict Alwar, Neemrana, District nan",301705.0,Rajasthan,2(f),Private Uni.csv,,,,,,,,,,Private_519,27.9681605,76.40727249999999,80,2,0.8,google
326.0,Private,Rai Technology University,"11th Mile Gallu, Doddaballapur Nelamangala Road, Mallohalli Village age, KadanurPost, MadureHobli, Doddaballapur Taluka uk, Bangalore SH-74, Off Highway 207, Doddaballapur Taluka uk, Bangalore, District nan, Karnataka",561204.0,Karnataka,2(f),Private Uni.csv,,,,,,,,,,Private_520,13.2308478,77.4502913,80,2,0.6,google
327.0,Private,Rai University,"Saroda, Dholka Taluka uka, Ahmedabad, GujaratAhmedabad, Gujarat, District nan",382260.0,Gujarat,2(f),Private Uni.csv,,,,,,,,,,Private_521,22.8249505,72.4886839,80,2,0.6,google
328.0,Private,Rajju Shroff Rofel University (RSRU),"Survey No. 78-79, ROFEL Campus, Namdha-Vapi, Valsad, District nan, Gujarat",396191.0,Gujarat,2(f),Private Uni.csv,,,,,,,,,,Private_522,20.3712774,72.89446579999999,80,2,0.8,google
329.0,Private,Ram Krishna Dharmarth Foundation (RKDF) University,"604, 5th Floor, Gopal Marketing ComplexNear Argora ChoukRanchi, District nan, Jharkhand",834004.0,Jharkhand,2(f),Private Uni.csv,,,,,,,,,,Private_523,23.3507193,85.30030169999999,80,2,1.0,google
330.0,Private,Rama University,"NH-91, Rama City, Mandhana, Kanpur, Uttar Pradesh Mandhana, Kanpur, District nan",209217.0,Uttar Pradesh,2(f),Private Uni.csv,,,,,,,,,,Private_524,26.5632925,80.2356741,80,2,0.8500000000000001,google
331.0,Private,Ramchandra Chandravansi University,"Nawadihkala, Post Office PS BishrampurPalamu, District nan, Jharkhand",822132.0,Jharkhand,2(f),Private Uni.csv,,,,,,,,,,Private_525,23.6913486,85.2722472,80,2,0.6,google
332.0,Private,Ramdeobaba University,"Ramdeo Tekadi, Katol Road, Nagpur, District nan, Maharashtra",440013.0,Maharashtra,2(f),Private Uni.csv,,,,,,,,,,Private_526,21.1744632,79.0562004,80,2,0.8500000000000001,google
351.0,Private,Sandip University,"Trimbak RoadMahiravani, Nashik, Maharashtra, District nan",422213.0,Maharashtra,2(f) & 12(B),Private Uni.csv,,,,,,,,,,Private_545,19.9668333,73.6631165,80,2,0.8500000000000001,google
3.0,Central,Babasaheb Bhimrao Ambedkar University,"Vidya Vihar, Rae Bareily Road, Lucknow, District nan, Uttar Pradesh",226025.0,Uttar Pradesh,2(f) & 12(B),Central Uni.csv,,,,,,,,,,Central_2,26.6505231,80.9931327,80,2,0.8500000000000001,google
335.0,Private,Renaissance University,"Gram Revti, Behind Aurobindo Hospital, Sanwer-Road, Indore MP5111 Gram Reoti, Sanwer Road, Behind Aurobindo Hospital, Indore, District nan, Madhya Pradesh",452015.0,Madhya Pradesh,2(f),Private Uni.csv,,,,,,,,,,Private_529,22.7978798,75.8453796,80,2,0.8,google
336.0,Private,Reva University,"Rukmani knowledge park, KattigenahalliYelahanka, Bangalore, District nan, Karnataka",560064.0,Karnataka,2(f),Private Uni.csv,,,,,,,,,,Private_530,13.1215682,77.6207127,80,2,0.6,google
337.0,Private,RIMT University,"Opposite Floating Restaurant, Sirhind Side, Mandi Gobindgarh, District nan, Punjab",147301.0,Punjab,2(f),Private Uni.csv,,,,,,,,,,Private_531,30.6245124,76.3863018,80,2,0.6,google
338.0,Private,Rishihood University,"NH-44 GT Road, Near Bahalgarh Chowk, Delhi NCR, Sonipat, District nan, Haryana",131021.0,Haryana,2(f),Private Uni.csv,,,,,,,,,,Private_532,28.9456534,77.0968177,80,2,0.8,google
340.0,Private,RKDF University,"Airport By Pass Road, Gandhi Nagar, Bhopal, Madhya PradeshGandhi NagarBhopal, District nan",462033.0,Madhya Pradesh,2(f),Private Uni.csv,,,,,,,,,,Private_534,23.3014715,77.36210539999999,80,2,0.6,google
341.0,Private,RV University,"RVU Administrative BuildingRV Vidyaniketan Post8th Mile, Mysuru Road, Bengaluru, District nan, Karnataka",560059.0,Karnataka,2(f),Private Uni.csv,,,,,,,,,,Private_535,12.9234996,77.49856969999999,80,2,1.0,google
342.0,Private,S. K. S. International University,"21st Milestone, NH-2, Tehsil sil Chatta, Mathura, District nan, Uttar Pradesh",281406.0,Uttar Pradesh,2(f),Private Uni.csv,,,,,,,,,,Private_536,27.2089015,77.9189584,80,2,0.8500000000000001,google
2.0,Central,Assam University,"Silchar, Dargakona, Cachar, District nan, Assam",788001.0,Assam,2(f) & 12(B),Central Uni.csv,,,,,,,,,,Central_1,24.6985246,92.75690449999999,80,2,0.8,google
344.0,Private,Sabarmati University,"Greenwood, Nr, Vaishnodevi CircleSardar patel Ring Road, OganjPO. Chandlodia, Ahmedabad, District nan, Gujarat",382481.0,Gujarat,2(f),Private Uni.csv,,,,,,,,,,Private_538,23.1365928,72.5421989,80,2,0.8,google
345.0,Private,Sage University,"KAILOD KARTAL RAU BYPASS INDOREIndore-Dewas Bypass Road, Rau, Indore, District nan, Madhya Pradesh",452020.0,Madhya Pradesh,2(f),Private Uni.csv,,,,,,,,,,Private_539,22.9418313,76.0630542,80,2,0.8500000000000001,google
