253.0,State,Maa Shakumbhari University,"Saharanpur, PunwarkaSaharanpur, District nan, Uttar Pradesh",247120.0,Uttar Pradesh,2(f),State Uni.csv,,,,,,,,,,State_944,30.0342539,77.62354130000001,80,2,0.6,google
254.0,State,Madan Mohan Malaviya University of Technology,"Deoria Road Gorakhpur, District nan, Uttar Pradesh",273010.0,Uttar Pradesh,2(f) & 12(B),State Uni.csv,,,,,,,,,,State_945,26.6660723,83.5372149,80,2,0.8500000000000001,google
255.0,State,Madhabdev University,"Narayanpur, Post Office Dikrong, Lakhimpur, AssamNarayanpur, Lakhimpur, District nan",784164.0,Assam,2(f),State Uni.csv,,,,,,,,,,State_946,26.952231,93.8568643,80,2,0.8,google
256.0,State,Madhusudan Law University,"Station Road, Cuttack, District nan, Odisha",750003.0,Odisha,2(f),State Uni.csv,,,,,,,,,,State_947,20.4723909,85.8857796,80,2,0.8500000000000001,google
257.0,State,Madhya Pradesh Medical Science University,"NSCB Medical College Campus, Bhedaghat Road, Jabalpur, District nan, Madhya Pradesh",482003.0,Madhya Pradesh,2(f),State Uni.csv,,,,,,,,,,State_948,23.1246329,79.8182379,80,2,0.8500000000000001,google
258.0,State,Madras University,"ChepaukChennai, District nan, Tamil Nadu",,Tamil Nadu,2(f) & 12(B),State Uni.csv,,,,,,,,,,State_949,13.0633338,80.2812089,80,2,0.6,google
280.0,State,Maharshi Dayanand Saraswati University,"Pushkar Bye PassAjmer, District nan, Rajasthan",305001.0,Rajasthan,2(f) & 12(B),State Uni.csv,,,,,,,,,,State_971,26.5368805,74.6024958,80,2,0.8500000000000001,google
259.0,State,Madurai Kamraj University,"Palkainagar, Madurai-625 021.T.N., District nan, Tamil Nadu",,Tamil Nadu,2(f) & 12(B),State Uni.csv,,,,,,,,,,State_950,9.9344226,78.0122786,80,2,0.6,google
261.0,State,Maharahtra University of Health Sciences,"Vani Dindori Road, Mhasrul, NashikNashik-422 005, District nan, Maharashtra",422004.0,Maharashtra,2(f),State Uni.csv,,,,,,,,,,State_952,20.0472722,73.8061283,80,2,0.8500000000000001,google
263.0,State,Maharaja Chhatrasal Bundelkhand Vishwavidyalaya,"GOVT MAHARAJA COLLEGE CAMPUS, District nan, Madhya Pradesh",471001.0,Madhya Pradesh,2(f),State Uni.csv,,,,,,,,,,State_954,22.9734229,78.6568942,80,2,0.6,google
264.0,State,Maharaja Ganga Singh University,"NH-15, Jaisalmer Road, Bikaner, District nan, Rajasthan",334004.0,Rajasthan,2(f),State Uni.csv,,,,,,,,,,State_955,28.0229311,73.2827137,80,2,1.0,google
265.0,State,Maharaja Krishnakumarsinji Bhavnagar University,"S.V. Patel Campus, Gaurishanker Lake Road, Bhavnagar, District nan, Gujarat",,Gujarat,2(f),State Uni.csv,,,,,,,,,,State_956,21.7622251,72.1296765,80,2,0.8500000000000001,google
266.0,State,Maharaja Ranjit Singh Punjab Technical University,"Dabwali Rd, Lal Singh Nagar, Bathinda, District nan, Punjab",151001.0,Punjab,2(f) & 12(B),State Uni.csv,,,,,,,,,,State_957,30.17877,74.9336461,80,2,0.8500000000000001,google
267.0,State,Maharaja Sayajirao University of Baroda,"Head Office, Maharaja Fatehsinghrao Gaekwad Road, Fatehgunj, Vadodara, District nan, Gujarat",390002.0,Gujarat,2(f) & 12(B),State Uni.csv,,,,,,,,,,State_958,22.324692,73.1891052,80,2,0.6,google
268.0,State,Maharaja Sriram Chandra Bhanja Deo University(Earlier North Orissa University),"Sriram Chandra Vihar, Takatpur, Baripada, Bhuabaneswar, District nan, Odisha",757003.0,Odisha,2(f) & 12(B),State Uni.csv,,,,,,,,,,State_959,21.9337967,86.755465,80,2,0.6,google
269.0,State,Maharaja Suhel Dev State University,"Raidopur, Azamgarh, District nan, Uttar Pradesh",276001.0,Uttar Pradesh,2(f),State Uni.csv,,,,,,,,,,State_960,26.0597007,83.1903543,80,2,0.6,google
270.0,State,Maharaja Surajmal Brij University,"Chak Sakitara, Kumher, Bharatpur, District nan, Rajasthan",321201.0,Rajasthan,2(f),State Uni.csv,,,,,,,,,,State_961,27.5216617,77.46732899999999,80,2,0.6,google
273.0,State,Maharani Cluster University,"Palace Road Bangalore Bengaluru, District nan, Karnataka",560001.0,Karnataka,2(f),State Uni.csv,,,,,,,,,,State_964,12.9847384,77.5881217,80,2,0.8500000000000001,google
274.0,State,Maharashtra Animal & Fishery Sciences University,"Futala Lake Road, NagpurSeminary Hills, Nagpur-440 006, District nan, Maharashtra",440001.0,Maharashtra,2(f),State Uni.csv,,,,,,,,,,State_965,21.1532941,79.0456516,80,2,0.8500000000000001,google
275.0,State,"Maharashtra National Law University, Aurangabad","Paithan Road, Kanchanwadi, Aurangabad, District nan, Maharashtra",431005.0,Maharashtra,2(f),State Uni.csv,,,,,,,,,,State_966,19.8365456,75.2923071,80,2,0.8500000000000001,google
277.0,State,"Maharashtra National Law University, Nagpur","Training InstituteJOTI, Civil Lines, C P Club Road, Nagpur, District nan, Maharashtra",440001.0,Maharashtra,2(f) & 12(B),State Uni.csv,,,,,,,,,,State_968,21.1551563,79.0562688,80,2,0.8500000000000001,google
278.0,State,Maharashtra State Skills University,"1st, Floor, Elphinstone Technical High School3, Mahapalika Marg, Metro ChowkMumbai, District nan, Maharashtra",400001.0,Maharashtra,2(f),State Uni.csv,,,,,,,,,,State_969,18.9434106,72.8302337,80,2,0.8,google
260.0,State,Magadh University,"Bodh Gaya, District nan, Bihar",824234.0,Bihar,2(f) & 12(B),State Uni.csv,,,,,,,,,,State_951,24.6961343,84.9869547,80,2,0.6,google
388.0,Private,Shri Rawatpura Sarkar University,"Near Shadani Darbar, Village -Dhaneli, Post Office- Mana, Dhamtari Road, Raipur, District nan, Chhattisgarh",,Chhattisgarh,2(f) & 12(B),Private Uni.csv,,,,,,,,,,Private_582,21.1932958,81.7170613,80,2,0.8,google
1.0,Central,Aligarh Muslim University,"Zainul Abidin Road, Aligarh, District nan, Uttar Pradesh",202001.0,Uttar Pradesh,2(f) & 12(B),Central Uni.csv,,,,,,,,,,Central_0,27.9141003,78.0779964,80,2,0.8500000000000001,google
386.0,Private,"Shri Ramasamy Memorial University, Sikkim","SRM University Sikkim, 5th Mile, Tadong, Gangtok, East Sikkim Tadong, RanipoolP.O. Gangtok, District nan",737102.0,Sikkim,2(f),Private Uni.csv,,,,,,,,,,Private_580,27.3180131,88.5976646,80,2,1.0,google
14.0,Private,Ajeenkya D.Y. Patil University,"Charholi BudrukVia Lohegaon, Pune, District nan, Maharashtra",412105.0,Maharashtra,2(f),Private Uni.csv,,,,,,,,,,Private_208,18.6537243,73.90774739999999,80,2,0.6,google
15.0,Private,Akal University,"Taluka wandi SaboDist. Bhathinda, District nan, Punjab",151302.0,Punjab,2(f),Private Uni.csv,,,,,,,,,,Private_209,30.1252438,75.06111469999999,80,2,0.6,google
30.0,Central,Jamia Millia Islamia,"Maulana Mohammad Ali Jauhar Marg, Jamia Nagar, District nan, Delhi",110025.0,Delhi,2(f) & 12(B),Central Uni.csv,,,,,,,,,,Central_29,28.5610812,77.2802867,80,2,0.8500000000000001,google
16.0,Private,Al-Falah University,"Faridabad, District nan, Haryana",121004.0,Haryana,2(f),Private Uni.csv,,,,,,,,,,Private_210,28.4046991,77.3324425,80,2,0.6,google
17.0,Private,Al-Karim University,"Sirsa, Karim Bagh, Katihar, District nan, Bihar",854106.0,Bihar,2(f),Private Uni.csv,,,,,,,,,,Private_211,25.5861203,87.55582679999999,80,2,0.8,google
18.0,Private,Alard University,"Alard Knowledge Park, Survey No. 47 and 50, Marunji, Near Rajiv Gandhi Park, IT Park, Hinjewadi, Pune, District nan, Maharashtra",411057.0,Maharashtra,2(f),Private Uni.csv,,,,,,,,,,Private_212,18.5932697,73.7363678,80,2,1.0,google
19.0,Private,Alliance University,"Chikkahagada Cross, Chandapura-Anekal Main Road, Bangalore, District nan, Karnataka",562106.0,Karnataka,2(f),Private Uni.csv,,,,,,,,,,Private_213,12.7590737,77.7037717,80,2,0.8500000000000001,google
20.0,Private,Amaltas University,"Dewas, Dewas-Ujjain State Highway, Bangar, District rict-Dewas, District nan, Madhya Pradesh",455001.0,Madhya Pradesh,2(f),Private Uni.csv,,,,,,,,,,Private_214,23.0222335,75.9747639,80,2,0.8500000000000001,google
21.0,Private,Amity University,"SP-1, Kant Kalwar, RIICO Industrial Area, NH-11C, Jaipur, RajasthanAjmer Road, Jaipur, District nan",303002.0,Rajasthan,2(f),Private Uni.csv,,,,,,,,,,Private_215,26.9594427,75.6585971,80,2,0.6,google
23.0,Private,AMITY University,"Panchgaon, Manesar, Gurgaon HaryanaPanchgaon, ManesarDistt.Gurgaon, District nan",122413.0,Haryana,2(f),Private Uni.csv,,,,,,,,,,Private_217,28.3515381,76.9427774,80,2,0.6,google
24.0,Private,Amity University,"Mumbai-Pune Expressway, Bhatan, Post - Somathne, Panvel, Mumbai, District nan, Maharashtra",410206.0,Maharashtra,2(f),Private Uni.csv,,,,,,,,,,Private_218,18.9341946,73.1593547,80,2,0.8500000000000001,google
25.0,Private,Amity University,"Village Manth Kharora Tehsil sil Tilda District Raipur ChhattisgarhTehsil- Tilda, District - Raipur, District nan",493225.0,Chhattisgarh,2(f),Private Uni.csv,,,,,,,,,,Private_219,21.40378,81.91409829999999,80,2,0.8,google
26.0,Private,Amity University,"Maharajpura, Gwalior Gwalior, District nan, Madhya Pradesh",474005.0,Madhya Pradesh,2(f),Private Uni.csv,,,,,,,,,,Private_220,26.292527,78.230526,80,2,0.6,google
27.0,Private,Amity University,"Rajarhat, New Town, District North 24 Parganas, District nan, West Bengal",700135.0,West Bengal,2(f),Private Uni.csv,,,,,,,,,,Private_221,22.5753931,88.47979029999999,80,2,0.6,google
13.0,Private,AISECT University,"Matwari Chowk, HazaribagMatwari, District t.- HazaribagHazaribagh, District nan, Jharkhand",825301.0,Jharkhand,2(f),Private Uni.csv,,,,,,,,,,Private_207,23.98882,85.3599693,80,2,0.8,google
28.0,Private,Amity University,"NH 648 Old 207, Beerasandra, Alurududdhanahalli Post, Devanahalli Taluka uk, Bengaluru Rural District rict, District nan, Karnataka",562110.0,Karnataka,2(f),Private Uni.csv,,,,,,,,,,Private_222,13.2815411,77.6134752,80,2,0.8500000000000001,google
30.0,Private,Amity University,"Sector-82 Alpha, IT City, S. A. A Nagar, Mohali, District nan, Punjab",140306.0,Punjab,2(f),Private Uni.csv,,,,,,,,,,Private_224,30.638471,76.7305415,80,2,0.8,google
29.0,Central,Indira Gandhi National Open University,"Maidan Garhi, New Delhi, District nan",110068.0,Delhi,2(f) & 12(B),Central Uni.csv,,,,,,,,,,Central_28,28.4985273,77.1951582,80,2,0.6,google
31.0,Private,Amity University,"Rupaspur, Bailey Road, Patna, District nan, Bihar",801503.0,Bihar,2(f),Private Uni.csv,,,,,,,,,,Private_225,25.610129,85.0604292,80,2,0.8500000000000001,google
28.0,Central,Indian Maritime University,"East Coast Road, Semmencherry, Chennai, District nan, Tamil Nadu",600119.0,Tamil Nadu,2(f) & 12(B),Central Uni.csv,,,,,,,,,,Central_27,12.9908026,80.2505029,80,2,0.8500000000000001,google
27.0,Central,Hemvati Nandan Bahuguna Garhwal University,"Madhi Chauras, Srinagar, Garhwal, District nan, Uttarakhand",246174.0,Uttarakhand,2(f) & 12(B),Central Uni.csv,,,,,,,,,,Central_26,30.2277668,78.8014505,80,2,0.6,google
34.0,Private,Anjaneya University,"Knowledge Village age, Naradha, Raipur, District nan, Chhattisgarh",493111.0,Chhattisgarh,2(f),Private Uni.csv,,,,,,,,,,Private_228,21.3690815,81.77870209999999,80,2,0.6,google
35.0,Private,Anurag University,"VenkatapurVGhatkesarMMedchal-Malkajigiri District , Hyderabad, District nan, Telangana",500088.0,Telangana,2(f),Private Uni.csv,,,,,,,,,,Private_229,17.406504,78.4772486,80,2,0.6,google
37.0,Private,Apex Professional University,"NH 52, 2nd Mile, Gumin Nagar, District nan, Arunachal Pradesh",791102.0,Arunachal Pradesh,2(f),Private Uni.csv,,,,,,,,,,Private_231,27.6626966,95.8802357,80,2,0.6,google
38.0,Private,Apex university,"Jaipur, Rajasthan, District nan",303002.0,Rajasthan,2(f),Private Uni.csv,,,,,,,,,,Private_232,26.9124336,75.7872709,80,2,0.6,google
39.0,Private,Arka Jain University,"Mohanpur, Gamharia, District - Seraikela KharsawanMohanpur, Gamharia, District Seraikela Kharsawan, District nan, Jharkhand",832108.0,Jharkhand,2(f),Private Uni.csv,,,,,,,,,,Private_233,22.8494051,86.10137209999999,80,2,0.6,google
40.0,Private,Arni University,"Karthgarh, Tehsil sil, Indore, District t. Kangra, District nan, Himachal Pradesh",176401.0,Himachal Pradesh,2(f),Private Uni.csv,,,,,,,,,,Private_234,32.0668524,76.3637285,80,2,0.6,google
41.0,Private,Arunachal University of Studies,"NH-52, Knowledge City, District t., Namsai, District nan, Arunachal Pradesh",792103.0,Arunachal Pradesh,2(f),Private Uni.csv,,,,,,,,,,Private_235,27.6564613,95.8764074,80,2,1.0,google
42.0,Private,Arunodaya University,"Lekhi Village age, Naharlagun, Itanagar, District t. Papum Pare, District nan, Arunachal Pradesh",791109.0,Arunachal Pradesh,2(f),Private Uni.csv,,,,,,,,,,Private_236,27.130829,93.7095229,80,2,0.8,google
43.0,Private,Aryavart University,"National Highway-46, Jharkheda, Tehsil sil-Shyampur, Sehore, District nan, Madhya Pradesh",466001.0,Madhya Pradesh,2(f),Private Uni.csv,,,,,,,,,,Private_237,23.418933,77.081043,80,2,0.8500000000000001,google
29.0,Private,Amity University,"Ranchi City Campus, Niwaranpur Adjoining Over Bridge, Main Road, Ranchi, District nan, Jharkhand",834002.0,Jharkhand,2(f),Private Uni.csv,,,,,,,,,,Private_223,23.3487589,85.3265378,80,2,0.8,google
44.0,Private,ASBM University,"Shiksha Vihar, Post Office -Bhola, Chandaka, District -Khurdha, Bhubaneswar, District nan, Odisha",754012.0,Odisha,2(f),Private Uni.csv,,,,,,,,,,Private_238,20.296435,85.84250399999999,80,2,0.8,google
12.0,Private,AIPH University,"APEX Building, Pahal, Bhubaneswar-Cuttack NH16On Bhubneshwar-Cuttack Road, NH-5Bhubneshwar, District nan, Odisha",752101.0,Odisha,2(f),Private Uni.csv,,,,,,,,,,Private_206,20.3587443,85.8891181,80,2,0.8500000000000001,google
10.0,Private,Agrawan Heritage University,"Bamrauli Katara, Fatehabad Road, Agra, District nan, Uttar Pradesh",283125.0,Uttar Pradesh,2(f),Private Uni.csv,,,,,,,,,,Private_204,27.1273208,78.1081916,80,2,0.8,google
121.0,Deemed to be Universities,St. Peters Institute of Higher Education and Research,"Tonakela Camp Road, Avadi, Chennai, District nan, Tamil Nadu",600054.0,Tamil Nadu,Section-III,Deemed to be Uni.csv,,,,,,,,,,Deemed to be Universities_177,13.107613,80.1264356,80,2,0.8500000000000001,google
122.0,Deemed to be Universities,Sumandeep Vidyapeeth,"Post Piparia, Takula Waghodiya, District Vadodara, District nan, Gujarat",391760.0,Gujarat,Section-III,Deemed to be Uni.csv,,,,,,,,,,Deemed to be Universities_178,22.7612936,78.3491007,80,2,0.6,google
123.0,Deemed to be Universities,Swami Vivekananda Yoga Anusandhana Samsthana,"Gavipuram Circle, Kempegowda Nagar, Agrahara, Bangalore, District nan, Karnataka",560019.0,Karnataka,Section-III & 12(B),Deemed to be Uni.csv,,,,,,,,,,Deemed to be Universities_179,12.9464492,77.5597925,80,2,0.6,google
124.0,Deemed to be Universities,Symbiosis International University,"Gram Lavale, Taluka Mulshi, District rict Pune, District nan, Maharashtra",412115.0,Maharashtra,Section-III & 12(B),Deemed to be Uni.csv,,,,,,,,,,Deemed to be Universities_180,18.5234811,73.7183639,80,2,0.6,google
125.0,Deemed to be Universities,Tata Institute of Fundamental Research,"Dr Homi Bhabha Road, Navy Nagar, Colaba, Mumbai, District nan, Maharashtra",400005.0,Maharashtra,Section-III & 12(B),Deemed to be Uni.csv,,,,,,,,,,Deemed to be Universities_181,18.9072598,72.8094811,80,2,0.8500000000000001,google
126.0,Deemed to be Universities,Tata Institute of Social Sciences,"VN Purav Marg, Deonar, Chembur, Mumbai, District nan, Maharashtra",400088.0,Maharashtra,Section-III & 12(B),Deemed to be Uni.csv,,,,,,,,,,Deemed to be Universities_182,19.0459446,72.9098689,80,2,0.8500000000000001,google
127.0,Deemed to be Universities,TERI School of Advanced studies,"10 Institutional Area, Vasant Kunj, New Delhi, District nan",110070.0,Delhi,Section-III,Deemed to be Uni.csv,,,,,,,,,,Deemed to be Universities_183,28.544115,77.1488545,80,2,1.0,google
128.0,Deemed to be Universities,Thapar Institute of Engineering & Technology,"Post Office Box 32, Bhadson Road, Patiala, District nan, Punjab",147004.0,Punjab,Section-III,Deemed to be Uni.csv,,,,,,,,,,Deemed to be Universities_184,30.3589466,76.3731947,80,2,1.0,google
129.0,Deemed to be Universities,The Gandhiigram Rural Institute,"Gandhigram, Dindigul District rict, Chinnalapatti, District nan, Tamil Nadu",624302.0,Tamil Nadu,Section-III & 12(B),Deemed to be Uni.csv,,,,,,,,,,Deemed to be Universities_185,10.2816816,77.9295807,80,2,0.6,google
130.0,Deemed to be Universities,The LNM Institute of Information Technology,"Gram-Rupa ki Nangal, Post-Sumel, District rict-Jaipur, Rajasthan",302031.0,Rajasthan,Section-III,Deemed to be Uni.csv,,,,,,,,,,Deemed to be Universities_186,26.9343648,75.9169275,80,2,0.6,google
34.0,Central,Manipur University,"Canchipur, Imphal, Manipur, District nan",795003.0,Manipur,2(f) & 12(B),Central Uni.csv,,,,,,,,,,Central_33,24.7475489,93.93695799999999,80,2,0.6,google
131.0,Deemed to be Universities,Tilak Maharashtra Vidyapeeth,"Vidyapeeth Bhavan, Mukundnagar, Gultekdi, Pune, District nan, Maharashtra",411037.0,Maharashtra,Section-III,Deemed to be Uni.csv,,,,,,,,,,Deemed to be Universities_187,18.4930908,73.86500079999999,80,2,0.8,google
132.0,Deemed to be Universities,Vel Tech Rangarajan Dr. Sagunthala R & D Institute of Science and Technology,"Avadi-Vel Tech Road, Avadi, Chennai, District nan, Tamil Nadu",600062.0,Tamil Nadu,Section-III,Deemed to be Uni.csv,,,,,,,,,,Deemed to be Universities_188,13.160506,80.099098,80,2,0.8,google
133.0,Deemed to be Universities,Velagapudi Ramakrishna Siddhartha Engineering College,"Vasantha Nagar, Kanuru, Vijayawada, Krishna District rict, District nan, Andhra Pradesh",520007.0,Andhra Pradesh,Section-III,Deemed to be Uni.csv,,,,,,,,,,Deemed to be Universities_189,16.482218,80.69256949999999,80,2,1.0,google
11.0,Private,Ahmedabad University,"Ahmedabad University, Commerce Six Roads, Navrangpura, Ahmedabad, GujaratAhmedabad, District nan",380009.0,Gujarat,2(f) & 12(B),Private Uni.csv,,,,,,,,,,Private_205,23.0381364,72.5543807,80,2,0.8,google
134.0,Deemed to be Universities,Vellore Institute of Technology,"Tiruvalam Rd, Katpadi, Vellore, District nan, Tamil Nadu",632014.0,Tamil Nadu,Section-III,Deemed to be Uni.csv,,,,,,,,,,Deemed to be Universities_190,12.9653375,79.151404,80,2,0.8500000000000001,google
136.0,Deemed to be Universities,"Vignan's Foundation for Science, Technology and Research","Vadlamudi, Guntur, District nan, Andhra Pradesh",522213.0,Andhra Pradesh,Section-III & 12(B),Deemed to be Uni.csv,,,,,,,,,,Deemed to be Universities_192,16.2355855,80.5605111,80,2,0.6,google
33.0,Central,Mahatma Gandhi Central University,"Camp Office Opposite Circuit House, Motihari, District t East Champaran, District nan, Bihar",845401.0,Bihar,2(f) & 12(B),Central Uni.csv,,,,,,,,,,Central_32,26.6307176,84.89664309999999,80,2,0.8,google
137.0,Deemed to be Universities,Vinayaka Missions Research Foundation,"NH47, Sankari Main Road, Salem, District nan, Tamil Nadu",636308.0,Tamil Nadu,Section-III,Deemed to be Uni.csv,,,,,,,,,,Deemed to be Universities_193,11.5795579,78.0461778,80,2,1.0,google
138.0,Deemed to be Universities,Yenepoya,"University road, Deralaktte, Mangalore, District nan, Karnataka",575018.0,Karnataka,Section-III,Deemed to be Uni.csv,,,,,,,,,,Deemed to be Universities_194,12.8083428,74.8936081,80,2,0.6,google
1.0,Private,A.K.S. University,"SherGanj, Satna, District nan, Madhya Pradesh",485001.0,Madhya Pradesh,2(f),Private Uni.csv,,,,,,,,,,Private_195,24.5714846,80.7907103,80,2,0.6,google
3.0,Private,AAFT University of Media and Arts,"Village -Maath, Tehsil sil-Tilda, District -Raipur, District nan, Chhattisgarh",493225.0,Chhattisgarh,2(f),Private Uni.csv,,,,,,,,,,Private_197,21.3929511,81.9043672,80,2,0.6,google
32.0,Central,Mahatma Gandhi Antarrashtriya Hindi Vishwavidyalaya,"Gandhi Hills, Post- Hindi Vishwavidyalaya, Wardha, District nan, Maharashtra",442001.0,Maharashtra,2(f) & 12(B),Central Uni.csv,,,,,,,,,,Central_31,20.8049123,78.5660852,80,2,0.6,google
4.0,Private,Abhilashi University,"Chailchowk ChaichiotTehsil chachyot, distt. Mandi, District nan, Himachal Pradesh",175045.0,Himachal Pradesh,2(f),Private Uni.csv,,,,,,,,,,Private_198,31.5654407,77.0003067,80,2,0.6,google
5.0,Private,Abhyuday University,"Garam Magriya, Khandwa Road, Khargone, District nan, Madhya Pradesh",451001.0,Madhya Pradesh,2(f),Private Uni.csv,,,,,,,,,,Private_199,21.8264035,75.6993486,80,2,0.6,google
6.0,Private,Adamas University,"Barasat - Barrackpore Rd, 24 Parganas North, Jagannathpur, Kolkata, West Bengal Barberia, Post Office JagannathpurPS Barasat, Kolkata, District nan",700126.0,West Bengal,2(f),Private Uni.csv,,,,,,,,,,Private_200,22.7573478,88.4351291,80,2,0.8500000000000001,google
7.0,Private,Adani University,"Shantigram Township, Near Vaishnodevi Circle, Ahmedabad, District nan, Gujarat",382421.0,Gujarat,2(f),Private Uni.csv,,,,,,,,,,Private_201,23.1362081,72.5422963,80,2,0.8500000000000001,google
31.0,Central,Jawaharlal Nehru University,"New Mehrauli Road, New Delhi, District nan",110067.0,Delhi,2(f) & 12(B),Central Uni.csv,,,,,,,,,,Central_30,28.5165633,77.2230546,80,2,0.8500000000000001,google
8.0,Private,Adesh University,"NH-7, Barnala Road, Bhucho, BathindaBathinda, District nan, Punjab",151101.0,Punjab,2(f),Private Uni.csv,,,,,,,,,,Private_202,30.2328988,74.9368528,80,2,0.8,google
9.0,Private,Adichunchanagiri University,"B G Nagara NH-75, Tq- Nagamangala, District - Mandya, District nan, Karnataka",571448.0,Karnataka,2(f),Private Uni.csv,,,,,,,,,,Private_203,13.0213539,77.0705723,80,2,0.8500000000000001,google
135.0,Deemed to be Universities,VELS Institute of Science Technology & Advanced Studies (VISTAS),"Velan Nagar, Pallavaram, Chennai, District nan, Tamil Nadu",600117.0,Tamil Nadu,Section-III,Deemed to be Uni.csv,,,,,,,,,,Deemed to be Universities_191,12.9563237,80.1616971,80,2,0.6,google
120.0,Deemed to be Universities,St. Aloysius,"St Aloysius College Road, Kodialbail, Post Box 720, Mangalore, District nan, Karnataka",575003.0,Karnataka,Section-III,Deemed to be Uni.csv,,,,,,,,,,Deemed to be Universities_176,12.8731163,74.8452081,80,2,0.8500000000000001,google
45.0,Private,Ashoka University,"Plot No. 2, Rajiv Gandhi Education City, Kundli, NCR Sonepat, District nan, Haryana",131028.0,Haryana,2(f) & 12(B),Private Uni.csv,,,,,,,,,,Private_239,28.9416006,77.1312586,80,2,0.6,google
47.0,Private,Assam Don Bosco University,"Azara, Guwahati, District nan, Assam",781017.0,Assam,2(f) & 12(B),Private Uni.csv,,,,,,,,,,Private_241,26.1238778,91.61734969999999,80,2,0.6,google
78.0,Private,C. V. Raman Global University,"Bidyanagar, Mahura, Janla, Bhubaneswar, District nan, Odisha",752054.0,Odisha,2(f),Private Uni.csv,,,,,,,,,,Private_272,20.216212,85.7128096,80,2,0.6,google
79.0,Private,Capital University,"Ranchi-Patna Main Road, District rict-Koderma, District nan, Jharkhand",825410.0,Jharkhand,2(f),Private Uni.csv,,,,,,,,,,Private_273,24.5886371,85.5326067,80,2,0.8500000000000001,google
81.0,Private,Career Point University,"Alniya, NH-52, Jhalawar Road, Kota, Rajasthan, District nan",325003.0,Rajasthan,2(f),Private Uni.csv,,,,,,,,,,Private_275,25.0322371,75.90927719999999,80,2,0.8,google
387.0,Private,Shri Ramswaroop Memorial University,"Village -Hadauri, Post-Tindola, Lucknow-Deva Road, BarabankiLucknow-Deva Road, Barabanki, District nan, Uttar Pradesh",225003.0,Uttar Pradesh,2(f),Private Uni.csv,,,,,,,,,,Private_581,26.9649322,81.1173248,80,2,0.8500000000000001,google
18.0,Central,Central University of Punjab,"VPO-Ghudda, District t. Bathinda, District nan, Punjab",151401.0,Punjab,2(f) & 12(B),Central Uni.csv,,,,,,,,,,Central_17,30.1244756,74.78929509999999,80,2,0.6,google
84.0,Private,CEPT University (Formerly Centre for Environmental Planning and Technology University),"University Road, Navrangpura, Ahmedabad, District nan, Gujarat",380009.0,Gujarat,2(f),Private Uni.csv,,,,,,,,,,Private_278,23.0339621,72.5491522,80,2,0.8500000000000001,google
85.0,Private,Chanakya University,"Brigade Orchards, Rayasandru Village age, Kasaba Hobli, Devanahalli Taluka uk, Bengaluru Rural District rict, District nan, Karnataka",562110.0,Karnataka,2(f),Private Uni.csv,,,,,,,,,,Private_279,13.165214,77.4092323,80,2,0.6,google
86.0,Private,Chandigarh University,"NH-95, Chandigarh Ludhiana Highway, Gharuan, Mohali, Punjab.Punjab, District nan",140413.0,Punjab,2(f) & 12(B),Private Uni.csv,,,,,,,,,,Private_280,30.769758,76.5755533,80,2,0.8,google
87.0,Private,Charotar University of Science & Technology,"Off Nadiad-Petlad Highway Road, Changa, District nan, Gujarat",388415.0,Gujarat,2(f),Private Uni.csv,,,,,,,,,,Private_281,22.5902575,72.8005865,80,2,0.6,google
88.0,Private,Chhatrapati Shivaji Maharaj University,"Near Shedung toll plaza, Old Mumbai-Pune Highway, Panvel, Navi Mumbai, MaharashtraOld Mumbai pune highway, panvel, navi mumbai, District nan",410206.0,Maharashtra,2(f),Private Uni.csv,,,,,,,,,,Private_282,18.7279734,73.6540415,80,2,0.8500000000000001,google
89.0,Private,Chirayu University,"Bhopal-Indore Highway, Near Bairagarh, Bhainsakhedi, District nan, Madhya Pradesh",462030.0,Madhya Pradesh,2(f),Private Uni.csv,,,,,,,,,,Private_283,22.9949634,76.55024,80,2,0.8500000000000001,google
90.0,Private,Chitkara  University,"Chandigarh-Patiala National Highway, Village age Jhansla, Tehsil sil Rajpura, District rict PatialaNH-64, JhansalaV, Rajpura PatialaNULL, District nan, Punjab",140401.0,Punjab,2(f),Private Uni.csv,,,,,,,,,,Private_284,30.4696268,76.56835219999999,80,2,0.8,google
91.0,Private,Chitkara University,"HIMUDA Education HubPIN: jore-Barotiwala Highway NH_21ASolan, District nan, Himachal Pradesh",,Himachal Pradesh,2(f),Private Uni.csv,,,,,,,,,,Private_285,30.9225523,76.8317325,80,2,0.6,google
17.0,Central,Central University of Odisha,"Sunabeda, Post NAD, District Koraput, District nan, Odisha",763004.0,Odisha,2(f) & 12(B),Central Uni.csv,,,,,,,,,,Central_16,18.7361387,82.8348087,80,2,0.6,google
77.0,Private,C. U. Shah University,"Surendranagar- Ahmedabad HighwayNr. Kothariya Village age, Wadhwan CitySurendranagar, District nan, Gujarat",363030.0,Gujarat,2(f),Private Uni.csv,,,,,,,,,,Private_271,23.022505,72.5713621,80,2,0.6,google
94.0,Private,"COER University, Roorkee","7KM. on Roorkee -Haridwar Road, Vardhmanpuram, Roorkee, District nan, Uttarakhand",247667.0,Uttarakhand,2(f),Private Uni.csv,,,,,,,,,,Private_288,29.9281544,78.1346534,80,2,0.8500000000000001,google
