id,institution_type,name,address,postal_code,state,status,source_file,Name of the college,Affiliated To University,College address,District,State,Year of Estb.,Teaching Upto,Govt or Non Govt,Aided or Unaided,unique_id,latitude,longitude,address_quality,geocoding_priority,geocoding_confidence,geocoding_source
398.0,Private,Sikkim International University,"Post Office SribadamP.S. Kaluk, West SikkimSikkim-, PIN: 737121, District nan",737121.0,Sikkim,2(f),Private Uni.csv,,,,,,,,,,Private_592,27.232447,88.2521105,100,1,0.6,google
308.0,State,Nanaji Deshmukh Pashu Chikitsa Vigyan Vishwavidyalaya,"Adhartal, Jabalpur-, Madhya PradeshJabalpur, PIN: 482004, District nan",482004.0,Madhya Pradesh,2(f),State Uni.csv,,,,,,,,,,State_999,23.2063705,79.94937159999999,100,1,1.0,google
32.0,State,Baba Ghulam Shah Badshah University,"Baba Ghulam Shah Badshah University, Rajouri, JK - 185234Road, Chinnai Himmat, Jammu, PIN: 185234, District nan, Jammu And Kashmir",185234.0,Jammu And Kashmir,2(f) & 12(B),State Uni.csv,,,,,,,,,,State_723,33.3954375,74.34768749999999,100,1,0.8,google
317.0,State,National University of Advanced Legal Studies (NUALS),"HMT Colony Post Office , Kalamassery, KochiKochi-, Kerala, PIN: 682017, District nan",683503.0,Kerala,2(f) & 12(B),State Uni.csv,,,,,,,,,,State_1008,10.0522094,76.3339664,100,1,0.8,google
330.0,State,Osmania University,"Administrative Building Osmania University Campus Hyderabad-, Telangana State, India.PIN - 500 007., PIN: 500007, District nan",500007.0,Telangana,2(f) & 12(B),State Uni.csv,,,,,,,,,,State_1021,17.4176446,78.5431066,100,1,0.6,google
332.0,State,Palamuru University,"Ayyappa ComplexOpp. Police Head Quarters, Mahabubnagar-, PIN: 509001, District nan, Telangana",509001.0,Telangana,2(f),State Uni.csv,,,,,,,,,,State_1023,16.7495885,77.9895901,100,1,1.0,google
263.0,Private,Manipal University,"Manipal University Jaipur, Dehmi Kalan, Off Jaipur-Ajmer Expressway, Jaipur, Raj. Rajasthan .Jaipur-Ajmer ExpressJaipur, PIN: 303007, District nan",303007.0,Rajasthan,2(f),Private Uni.csv,,,,,,,,,,Private_457,26.6626828,75.1942178,100,1,0.8500000000000001,google
335.0,State,Pandit Sundarlal Sharma (Open) University,"Koni Birkona Road, Bilaspur, Chhattisgarh, Bilaspur-495001Chhattisgarh, PIN: 495001, District nan",495009.0,Chhattisgarh,2(f),State Uni.csv,,,,,,,,,,State_1026,22.1198497,82.1569492,100,1,0.8500000000000001,google
266.0,Private,Martin Luther Christian University,"Block 1, Dongktieh, Nongrah, Shillong, Meghalaya 793006Nongrah, Shillong, Meghalaya, PIN: 793006, District nan",793006.0,Meghalaya,2(f),Private Uni.csv,,,,,,,,,,Private_460,25.5722167,91.9230671,100,1,0.8,google
340.0,State,Potti Sreeramulu Telugu University,"Lalitakala -KshetramHyderabad-, PIN: 500004, District nan, Telangana",500004.0,Telangana,2(f) & 12(B),State Uni.csv,,,,,,,,,,State_1031,18.1124372,79.01929969999999,100,1,0.6,google
344.0,State,Pt. Bhagwat Dayal Sharma University of Health Sciences,"Rohtak-124001Haryana, PIN: 124001, District nan",124001.0,Haryana,2(f) & 12(B),State Uni.csv,,,,,,,,,,State_1035,28.8955152,76.606611,100,1,0.6,google
270.0,Private,Maulana Azad University,"Village age - Bujhawar, Tehsil sil Luni, Jodhpur - Raj.Jodhpur, PIN: 342802, District nan, Rajasthan",342802.0,Rajasthan,2(f),Private Uni.csv,,,,,,,,,,Private_464,25.9976307,73.0001334,100,1,0.8,google
233.0,Private,M.V.N. University,"74 KM Stone, NH-2, Delhi-Agra Highway, Palwal Haryana - 121105Delhi-Agra Highway, Palwal, PIN: 121105, District nan",121105.0,Haryana,2(f),Private Uni.csv,,,,,,,,,,Private_427,27.9813512,77.3365875,100,1,0.8,google
349.0,State,Punyashlok Ahilyadevi Holkar Solapur University,"Kegaon, Solapur-Pune National Highway, Solapur-, Maharashtra IndiaSolapur Pune national HighwayKegaon, Solapur- Maharashtra, PIN: 413255, District nan",413255.0,Maharashtra,2(f) & 12(B),State Uni.csv,,,,,,,,,,State_1040,18.1636098,74.9612757,100,1,0.8500000000000001,google
474.0,Private,University of Engineering and Management,"UNIVERSITY AREA, PLOT NO. III B5, NEW TOWN, ACTION AREA III, KOLKATA 700 160, KOLKATA, KOLKATA, West Bengal, 700160Main Arterial Road East-West, New town, Action Area-III, Kolkata, PIN: 700160, District nan",700160.0,West Bengal,2(f),Private Uni.csv,,,,,,,,,,Private_668,22.5754527,88.4514018,100,1,0.8500000000000001,google
382.0,State,Sant Gadge Baba Amravati University,"Camp, ti, Amravati-444602M.S., PIN: 444602, District nan, Maharashtra",444602.0,Maharashtra,2(f) & 12(B),State Uni.csv,,,,,,,,,,State_1073,20.9035839,77.6307018,100,1,0.6,google
389.0,State,Sardar Vallabh Bhai Patel University of Agriculture & Technology,"Modipuram, Meerut, U.P-, PIN: 250110, District nan, Uttar Pradesh",250110.0,Uttar Pradesh,2(f),State Uni.csv,,,,,,,,,,State_1080,29.0661177,77.7103995,100,1,0.6,google
465.0,Private,The Institute of Chartered Financial Analysts of India University,"Plot No. 2065, Daladali Chowk, Simalia, Near Ring Road, Ranchi-, JharkhandRanchi, PIN: 835222, District nan",835222.0,Jharkhand,2(f),Private Uni.csv,,,,,,,,,,Private_659,23.3661245,85.2326831,100,1,1.0,google
308.0,Private,Parul University,"Post Office Limda, Ta Waghodia, District Vadodara-391760Tal - WaghodiaDist. Vadodara, PIN: 391760, District nan, Gujarat",391760.0,Gujarat,2(f),Private Uni.csv,,,,,,,,,,Private_502,22.2829356,73.3631329,100,1,0.6,google
394.0,State,Shaheed Mahendra Karma Vishvidyalaya,"Dharampura 2, Jagdalpur, District t. Bastar, ChhattisgarhChhattisgarh -, PIN: 494005, District nan",494001.0,Chhattisgarh,2(f),State Uni.csv,,,,,,,,,,State_1085,19.0861377,82.0188426,100,1,1.0,google
401.0,State,Shri Govind Guru University,"Government Polytechnic Campus, RTO Road, Gadukpur, Godhra, District Panchmahal Gujarat- Gadukpur, Godhra, District Panchmahals, PIN: 389001, District nan",389001.0,Gujarat,2(f),State Uni.csv,,,,,,,,,,State_1092,22.7618954,73.6338201,100,1,0.8,google
318.0,Private,Pratap University,"Pratap University, Sunderpura Chandwaji, Delhi-Mumbai Highway, Jaipur, Rajasthan-, PIN: 303104, District nan",303104.0,Rajasthan,2(f),Private Uni.csv,,,,,,,,,,Private_512,27.2237346,75.94777549999999,100,1,0.6,google
319.0,Private,Presidency  University,"Itgalpur, Rajanakunte, Yelahanka, Bengaluru, 560064RajanakunteBangaluru, PIN: 560064, District nan, Karnataka",560064.0,Karnataka,2(f),Private Uni.csv,,,,,,,,,,Private_513,13.1154662,77.6069977,100,1,0.6,google
408.0,State,Sidho-Kanho-Birsha University,"Sidho-Kanho-Birsha University, Rachi Road, Post Office - Sainik School, District - Purulia, PIN-, West BengalRanchi Road Campus, Near Sainik School, Purulia, PIN: 723104, District nan",723104.0,West Bengal,2(f) & 12(B),State Uni.csv,,,,,,,,,,State_1099,23.3561568,86.34147840000001,100,1,0.6,google
450.0,Private,Teerthanker Mahaveer University,"N.H.-24, Delhi Road, Moradabad - , Uttar Pradesh, PIN: 244001, District nan",244001.0,Uttar Pradesh,2(f) & 12(B),Private Uni.csv,,,,,,,,,,Private_644,28.8297499,78.7392065,100,1,1.0,google
493.0,Private,William Carey University,"Nongmensong, Umkdait, Near Border Roads Organisatio, Shillong - , Meghalaya - IndiaUmkdait, Shillong, PIN: 793019, District nan",793019.0,Meghalaya,2(f),Private Uni.csv,,,,,,,,,,Private_687,25.586804,91.9087026,100,1,0.8,google
449.0,Private,Techno India University,"EM 4, Sector V, Salt Lake, Kolkata-700091Salt LakeKolkata, PIN: 700091, District nan, West Bengal",700091.0,West Bengal,2(f),Private Uni.csv,,,,,,,,,,Private_643,22.5759407,88.42717379999999,100,1,1.0,google
45.0,State,Bharathiar University,"Bharathiar University, Marudhamalai Main Road, Coimbatore-641046PIN - 641 046.Tamil Nadu, PIN: 641046, District nan",641046.0,Tamil Nadu,2(f) & 12(B),State Uni.csv,,,,,,,,,,State_736,11.0335438,76.88654869999999,100,1,1.0,google
227.0,Private,Lok Jagruti Kendra University,"FP No. 74, TPS No. 86, Sarkhej-okaf-Fatewadi, Makrba, District Ahmedabad, PIN: 100113, District nan, Gujarat",100113.0,Gujarat,2(f),Private Uni.csv,,,,,,,,,,Private_421,22.9848581,72.5174174,100,1,0.6,google
162.0,State,Hidayatullah National Law University,"Nava Raipur Atal Nagar, RaipurChattisgarh-, PIN: 493661, District nan, Chhattisgarh",492002.0,Chhattisgarh,2(f) & 12(B),State Uni.csv,,,,,,,,,,State_853,21.0582119,81.71305219999999,100,1,0.6,google
163.0,State,Himachal Pradesh National Law University,"Himachal Pradesh National Law University, Ghandal. Sub Tehsil sil Dhami, Shimla, Himachal Pradesh-171014Sub-Tehsil sil Dhami, Shimla, PIN: 171014, District nan",171014.0,Himachal Pradesh,2(f),State Uni.csv,,,,,,,,,,State_854,31.1608326,77.0463577,100,1,0.8,google
104.0,Private,Desh Bhagat University,"Desh Bhagat University, Village age Saunti, Tehsil sil Amloh, District rict Fatehgarh Sahib, Punjab Mandi Gobindgarh Pb., PIN: 147203, District nan",147203.0,Punjab,2(f) & 12(B),Private Uni.csv,,,,,,,,,,Private_298,30.6154764,76.2368834,100,1,0.8,google
131.0,Private,G. D. Goenka University,"G. D. Goenka Education City, Sohna, Gurugram Road, Delhi-NCR, Haryana-, IndiaSohna Gurgaon RoadSohna, Haryana, PIN: 122103, District nan",122103.0,Haryana,2(f),Private Uni.csv,,,,,,,,,,Private_325,28.2692976,77.06656219999999,100,1,0.8,google
140.0,State,Gujarat Ayurveda University,"Gujarat Ayurved University, Opp. B Division Police Station, Guru Dwara Road, Jamnagar-361008Jamnagar-361 008, PIN: 361008, District nan",361008.0,Gujarat,2(f) & 12(B),State Uni.csv,,,,,,,,,,State_831,22.4750606,70.0647233,100,1,1.0,google
182.0,State,Jagadguru Ramanandacharya Sanskrit University,"Bhankrota - Muhana Link Road, Madau, JaipurJaipur-, PIN: 302026, District nan, Rajasthan",302026.0,Rajasthan,2(f) & 12(B),State Uni.csv,,,,,,,,,,State_873,26.8892685,75.68667909999999,100,1,1.0,google
135.0,State,Gauhati University,"Gopinath Bordoloi Nagar, Guwahati - KAMRUP, AssamGuwahati, PIN: 781014, District nan",781014.0,Assam,2(f) & 12(B),State Uni.csv,,,,,,,,,,State_826,26.1647249,91.66878129999999,100,1,0.6,google
146.0,Private,Gokul Global University,"GOKUL GLOBAL UNIVERSITY, NEAR SUJANPUR PATIA, OPPOSITE IOC DEPOT, STATE HIGHWAY-41, SIDDHPUR-384151Near G. R. S. L., Sujanpur PatiaSidhpur, District - Patan, PIN: 384151, District nan, Gujarat",384151.0,Gujarat,2(f),Private Uni.csv,,,,,,,,,,Private_340,23.9599995,72.359231,100,1,0.6,google
80.0,Private,Career Point University,"Career Point University Hamirpur, Campus Bhoranj Tikker - Kharwarian, Hamirpur, H.P - Contact 91-1972-269702, 91-8261001325 Email hpcpuniverse.in, PIN: 176041, District nan, Himachal Pradesh",176041.0,Himachal Pradesh,2(f),Private Uni.csv,,,,,,,,,,Private_274,31.6218631,76.6231973,100,1,0.8,google
75.0,Private,BML Munjal University,"67th Milestone, National Highway - 8 Sidhrawali, Gurugram, Haryana -123413NH-8, Village age Sidhrawali, Gurugram, PIN: 123413, District nan",123413.0,Haryana,2(f),Private Uni.csv,,,,,,,,,,Private_269,28.4105368,76.9930888,100,1,0.8,google
118.0,State,Dr. Babasaheb AmbedkarTechnological University,"Dr. Babasaheb Ambedkar Technological University LonereVidyavihar, AP Lonere, Taluka Mangaon, District Raigad, Maharashtra, 402013Lonere-402103, Dt-Raigad., PIN: 402013, District nan",402103.0,Maharashtra,2(f) & 12(B),State Uni.csv,,,,,,,,,,State_809,18.1577411,73.32075999999999,100,1,0.6,google
230.0,Private,Lovely Professional University,"Jalandhar-Delhi G.T. Road, Phagwara, District t. Kapurthala, Punjab - 144411Ludhiana, PhagwaraDistt. Kappurthala, PIN: 144411, District nan",144411.0,Punjab,2(f),Private Uni.csv,,,,,,,,,,Private_424,30.6604908,76.2975805,100,1,0.8500000000000001,google
68.0,Private,Bhaikaka University,"Gokal Nagar, Karamsad Gujarat, India Karamsad, PIN: 388325, District nan",388325.0,Gujarat,2(f),Private Uni.csv,,,,,,,,,,Private_262,22.5429215,72.90176029999999,100,1,0.6,google
212.0,State,Karnataka  State Law University,"Navanagar, Hubli-580025Karnataka, PIN: 580025, District nan",580025.0,Karnataka,2(f) & 12(B),State Uni.csv,,,,,,,,,,State_903,15.3935685,75.0800957,100,1,0.6,google
213.0,State,Karnataka  State Open University,"ManasangangotriMysore-, PIN: 570006, District nan, Karnataka",570006.0,Karnataka,2(f) & 12(B),State Uni.csv,,,,,,,,,,State_904,12.314831,76.62105389999999,100,1,0.6,google
169.0,Private,IILM University,"IILM University, 1, Knowledge Centre, Golf Course Road, Sector-53, Gurugram-Haryana-122003Golf course RoadSector-53, Gurugram, PIN: 122003, District nan",122003.0,Haryana,2(f),Private Uni.csv,,,,,,,,,,Private_363,28.4426194,77.0954264,100,1,0.8500000000000001,google
222.0,State,Kavi Kulguru Kalidas Sanskrit Vishwavidyalaya,"Administration Building, Mouda Road, Ramtek, District Nagpur Ramtek-, District NagpurMaharashtra, PIN: 441106, District nan",441106.0,Maharashtra,2(f) & 12(B),State Uni.csv,,,,,,,,,,State_913,21.3720124,79.3118286,100,1,0.8,google
225.0,State,Kerala Agricultural Unviersity,"Kerala Agricultural University KAU Main Campus KAU Post Office , Vellanikkara, Thrissur, Kerala, 680656Thrissur - 680 654., PIN: 680656, District nan",680656.0,Kerala,2(f) & 12(B),State Uni.csv,,,,,,,,,,State_916,10.5485377,76.2873675,100,1,0.8,google
92.0,State,Davangere University,"Davangere University, Shivagangotri, DavangereDavangere Karnataka-, PIN: 577002, District nan",577007.0,Karnataka,2(f) & 12(B),State Uni.csv,,,,,,,,,,State_783,14.3934494,75.9649056,100,1,0.8,google
36.0,Private,Apeejay Stya University,"Sohna - Palwal Road, Sohna, Gurugram - 122103Gurgaon, PIN: 122103, District nan, Haryana",122103.0,Haryana,2(f) & 12(B),Private Uni.csv,,,,,,,,,,Private_230,28.2411474,77.0782707,100,1,0.8500000000000001,google
243.0,State,Kumar Bhaskar Varma Sanskrit & Ancient Studies University,"NAMATI, HATI NAMATI, NALBARI, ASSAM-, INDIAP.O.- Hati NamatiDist-Nalbari, Assam, PIN: 781337, District nan",781337.0,Assam,2(f) & 12(B),State Uni.csv,,,,,,,,,,State_934,26.497747,91.447364,100,1,0.8,google
22.0,Private,AMITY University,"Plot No. 4, Gautam Buddha Nagar, Sector-125, Noida, Uttar Pradesh PIN 201313Gautam Budh Nagar, PIN: 201313, District nan",201313.0,Uttar Pradesh,2(f),Private Uni.csv,,,,,,,,,,Private_216,28.5437925,77.3310067,100,1,0.6,google
272.0,State,Maharana Pratap University of Agriculture & Technology,"Maharana Pratap University of Agriculture Technology, Udaipur 313001Udaipur-, PIN: 313001, District nan, Rajasthan",313001.0,Rajasthan,2(f),State Uni.csv,,,,,,,,,,State_963,24.5914654,73.73020369999999,100,1,0.8,google
2.0,Private,A.P.G. (Alakh Prakash Goyal) Shimla University,"Shogi- Mehli Bypass Road, Shimla, H.P, PIN: 171013, District nan, Himachal Pradesh",171009.0,Himachal Pradesh,2(f),Private Uni.csv,,,,,,,,,,Private_196,31.0587512,77.1558316,100,1,0.8500000000000001,google
111.0,State,Dr. B. R. Ambedkar University of Social Sciences,"Dr. Ambedkar Nagar, Mhow-453441Dist-Indore, MP, PIN: 453441, District nan, Madhya Pradesh",453441.0,Madhya Pradesh,2(f) & 12(B),State Uni.csv,,,,,,,,,,State_802,22.5550149,75.77052929999999,100,1,0.8,google
339.0,Private,RK University,"RK University, Bhavnagar Highway, Kasturbadham, Rajkot - , Gujarat, India.Rajkot, PIN: 360020, District nan",360020.0,Gujarat,2(f),Private Uni.csv,,,,,,,,,,Private_533,22.2404115,70.9004241,100,1,0.8,google
322.0,State,Nilamber-Pitamber University,"Madininager, Palamu-822101Jharkhand, PIN: 822101, District nan",822101.0,Jharkhand,2(f),State Uni.csv,,,,,,,,,,State_1013,24.0420432,84.0907246,100,1,0.6,google
474.0,State,Veer Bahadur Singh Purvanchal University,"Shahganj Road, JaunpurPIN- U.P., PIN: 222002, District nan, Uttar Pradesh",222002.0,Uttar Pradesh,2(f) & 12(B),State Uni.csv,,,,,,,,,,State_1165,25.7851923,82.6898596,100,1,0.8500000000000001,google
458.0,State,University of Gour Banga,"Post Office - Mokdumpur, District rict - Malda, West Bengal, PIN: Code - 732103Distt. Malda, PIN: 732103, District nan",732103.0,West Bengal,2(f) & 12(B),State Uni.csv,,,,,,,,,,State_1149,24.9916827,88.1436993,100,1,0.6,google
453.0,State,U.P. Rajarshi Tandon Open University,"Shantipuram Sector-F, Phaphamau, Prayagraj, Uttar Pradesh.Sector-FPhaphamauAllahabad-, PIN: 211013, District nan",211013.0,Uttar Pradesh,2(f),State Uni.csv,,,,,,,,,,State_1144,25.5293499,81.8538539,100,1,0.6,google
435.0,State,Tamilnadu Agricultural University,"Lawley Road, Coimbatore , Tamilnadu, PIN: 641003, District nan, Tamil Nadu",641003.0,Tamil Nadu,2(f) & 12(B),State Uni.csv,,,,,,,,,,State_1126,11.0124333,76.94089989999999,100,1,0.6,google
488.0,State,West Bengal University of Animal and Fishery Sciences,"37 68, ksudiram Bose Sarani, Kolkata-, PIN: 700037, District nan, West Bengal",700037.0,West Bengal,2(f) & 12(B),State Uni.csv,,,,,,,,,,State_1179,22.6061322,88.3869866,100,1,0.9,google
382.0,Private,Shri Jagdish Prasad Jhabarmal Tibrewala University,"Shri Jagdishprasad Jhabarmal Tibrewala University, Vidyanagri, Jhunjhunu Bisau Road, Chudela, District rict - Jhunjhunu, Rajasthan -333001Chudela, District t., -Jhunjhunu, PIN: 333001, District nan",333001.0,Rajasthan,2(f),Private Uni.csv,,,,,,,,,,Private_576,28.176763,75.2455438,100,1,0.8,google
356.0,Private,Sankalchand Patel University,"Sankalchand Patel Vidyadham Ambaji-Gandhinagar State Highway, Visnagar-. District Mehsana, Gujarat INDIAVisnagar-384315Gujarat, PIN: 384315, District nan",384315.0,Gujarat,2(f),Private Uni.csv,,,,,,,,,,Private_550,23.2156354,72.63694149999999,100,1,0.6,google
422.0,Private,Sri Sri University,"Ward No 3, Sandhapur, Godi Sahi, Cuttack Vidhayadharpur, Odisha 754006Godi Sahi, Ward No. 3 Cuttack Odisha., PIN: 754006, District nan",754006.0,Odisha,2(f) & 12(B),Private Uni.csv,,,,,,,,,,Private_616,20.4495623,85.8044584,100,1,0.6,google
436.0,State,Tamilnadu Dr. Ambedkar Law University,"Poompozhil, 5.Dr.D.G.S. dinakaranSalai, Raja Annamalai Puram, Chennai-, T.N., PIN: 600028, District nan, Tamil Nadu",600028.0,Tamil Nadu,2(f) & 12(B),State Uni.csv,,,,,,,,,,State_1127,13.0185354,80.2661151,100,1,1.0,google
467.0,State,Uttar Banga Krishi Vishwavidyalaya,"Post Office Pundibari, District Coochbehar, PIN- 736165Cooch Behar, West Bengal-, PIN: 736165, District nan",736165.0,West Bengal,2(f),State Uni.csv,,,,,,,,,,State_1158,26.4416551,89.3795835,100,1,0.6,google
481.0,State,Vidya Sagar University,"Post Office -Vidyasagar UniversityMidnapore-, District -paschim Mediripur, W.B., PIN: 721102, District nan, West Bengal",721102.0,West Bengal,2(f) & 12(B),State Uni.csv,,,,,,,,,,State_1172,22.4314374,87.29730169999999,100,1,1.0,google
432.0,State,Tamil Nadu Physical Education and Sports University,"Melakottaiyur, ChennaiSampat Maaligai, college Road, Chennai-, PIN: 600006, District nan, Tamil Nadu",600127.0,Tamil Nadu,2(f),State Uni.csv,,,,,,,,,,State_1123,13.0676628,80.2494469,100,1,0.8500000000000001,google
490.0,State,Yashwant Rao Chavan Maharashtra Open University,"Dnyangangotri Near Gangapur Dam, Nashik, MaharashtraIndiaGangapur Dam, Nasik-, PIN: 422222, District nan",422222.0,Maharashtra,2(f) & 12(B),State Uni.csv,,,,,,,,,,State_1181,20.0481104,73.6798096,100,1,1.0,google
85.0,State,COEP Technological University,"Wellesley Road, Shivajinagar, Pune, District nan, Maharashtra",411005.0,Maharashtra,2(f),State Uni.csv,,,,,,,,,,State_776,18.5298985,73.869318,80,2,0.8500000000000001,google
87.0,State,Cotton University,"PANBAZAR, Guwahati, District nan, Assam",781001.0,Assam,2(f) & 12(B),State Uni.csv,,,,,,,,,,State_778,26.1859679,91.7453642,80,2,0.6,google
88.0,State,Dada Lakhmi Chand State University of Performing and Visual Arts (SUPVA),"Sector-6, Near Rajiv Gandhi Stadium, Rohtak, District nan, Haryana",124001.0,Haryana,2(f),State Uni.csv,,,,,,,,,,State_779,28.9219972,76.6098493,80,2,0.8,google
84.0,State,Cochin Unviersity of Science & Technology,"Cochin University of Science and technology, Kochi, Ernakulam, Kerala State, District nan",682022.0,Kerala,2(f) & 12(B),State Uni.csv,,,,,,,,,,State_775,10.0430092,76.32428689999999,80,2,0.8,google
83.0,State,Cluster University of Srinagar,"Gogji-Bagh, Srinagar, District nan, Jammu And Kashmir",190008.0,Jammu And Kashmir,2(f),State Uni.csv,,,,,,,,,,State_774,34.0609016,74.8083078,80,2,0.6,google
82.0,State,Cluster University of Jammu,"Adjoining G.G.M. Science College, Canal Road, Jammu, District nan, Jammu And Kashmir",180016.0,Jammu And Kashmir,2(f),State Uni.csv,,,,,,,,,,State_773,32.7250345,74.8519973,80,2,0.8,google
81.0,State,Cluster University,"Silver Jubilee Government College Campus, Kurnool, District nan, Andhra Pradesh",518007.0,Andhra Pradesh,2(f),State Uni.csv,,,,,,,,,,State_772,15.8025267,78.0390769,80,2,0.8,google
86.0,State,Cooch Behar Panchanan Barma University,"COOCH BEHAR PANCHANAN BARMA UNIVERSITY, Panchanan Nagar, Vivekananda Street, Cooch Behar - , West Bengal, IndiaCooch Behar, PIN: 736101",736101.0,West Bengal,2(f),State Uni.csv,,,,,,,,,,State_777,26.3215884,89.4695429,80,2,0.8,google
433.0,Private,Surendranagar University,"Shree Pandit Nathulalji Vyas Technical CampusSurendranagar- Ahmedabad HighwayNear Kothariya Village age, At Wadhwan, District nan, Gujarat",363030.0,Gujarat,2(f),Private Uni.csv,,,,,,,,,,Private_627,22.711454,71.6732681,80,2,0.6,google
90.0,State,Damodaram Sanjivayya National Law University,"Sabbavaram, Pedawaltair, Visakhapatnam, District nan, Andhra Pradesh",531035.0,Andhra Pradesh,2(f) & 12(B),State Uni.csv,,,,,,,,,,State_781,17.7308332,83.3354994,80,2,0.6,google
80.0,State,Choudhary Charan Singh Haryana Agricultural Univeersity,"Directorate of Human resource Management, District nan, Haryana",125004.0,Haryana,2(f) & 12(B),State Uni.csv,,,,,,,,,,State_771,29.1442503,75.709981,80,2,1.0,google
404.0,Private,Singhania University,"Pacheri BariDistrict Jhunjhunu, District nan, Rajasthan",333515.0,Rajasthan,2(f),Private Uni.csv,,,,,,,,,,Private_598,28.1398667,75.94777549999999,80,2,0.6,google
91.0,State,Darjeeling Hills University,"Jogighat MangpuDist.- Darjeeling, District nan, West Bengal",734313.0,West Bengal,2(f),State Uni.csv,,,,,,,,,,State_782,26.9436345,88.36066339999999,80,2,0.8,google
403.0,Private,Silver Oak University,"Nr. Bhavik Publications, Opp. Bhagwat Vidhyapith, S.G. Highway, Gota, Ahmedabad Gota, Ahmedabad, District nan, Gujarat",382481.0,Gujarat,2(f),Private Uni.csv,,,,,,,,,,Private_597,23.0864485,72.5281675,80,2,0.8,google
93.0,State,Deen Bandhu Chhotu Ram University of Sciences & Technology,"50th K.M. Stone, N.H. 1, Murthal Sonepat Haryana, India, District nan",131039.0,Haryana,2(f) & 12(B),State Uni.csv,,,,,,,,,,State_784,28.9734641,77.0902341,80,2,1.0,google
94.0,State,Deen Dayal Upadhyay Gorakhpur University,"Civil Lines, GorakhpurPIN - 273 009. U.P., District nan, Uttar Pradesh",273009.0,Uttar Pradesh,2(f) & 12(B),State Uni.csv,,,,,,,,,,State_785,25.4529334,81.8348882,80,2,0.6,google
95.0,State,Delhi Pharmaceutical Sciences & Research University,"M.B. Road, Sector - III, Pushp Vihar, District nan, Delhi",110017.0,Delhi,2(f),State Uni.csv,,,,,,,,,,State_786,28.5168183,77.2218359,80,2,0.8500000000000001,google
96.0,State,Delhi Skill and Entrepreneurship University,"Integrated Institute of Technology Complex, Sector-9, Dwarka, District nan, Delhi",110007.0,Delhi,2(f),State Uni.csv,,,,,,,,,,State_787,28.5824959,77.0637777,80,2,0.8,google
97.0,State,Delhi Sports University,"Ludlow Castle Sports ComplexShamnath MargDelhi, District nan",110054.0,Delhi,2(f),State Uni.csv,,,,,,,,,,State_788,28.67137529999999,77.2260396,80,2,1.0,google
98.0,State,Delhi Teachers University,"P 625 745, Outram Lane, New Delhi, District nan",110009.0,Delhi,2(f),State Uni.csv,,,,,,,,,,State_789,28.7005844,77.2085488,80,2,0.9,google
99.0,State,Delhi Technological University,"Shahbad Daultapur, Bawana Road, Rohini, District nan, Delhi",110042.0,Delhi,2(f) & 12(B),State Uni.csv,,,,,,,,,,State_790,28.8216673,77.0664146,80,2,0.8500000000000001,google
100.0,State,Devi Ahilya Vishwavidyalaya,"R.N.Tagore Marg, Indore, District nan, Madhya Pradesh",,Madhya Pradesh,2(f) & 12(B),State Uni.csv,,,,,,,,,,State_791,22.7143998,75.8745102,80,2,0.8500000000000001,google
89.0,State,Dakshin Dinajpur University,"North Chakbhabani near LIC officeBalurghat, Dakshin Dinajpur, District nan, West Bengal",733101.0,West Bengal,2(f),State Uni.csv,,,,,,,,,,State_780,25.2328259,88.774812,80,2,0.8,google
79.0,State,Children's University,"Subhash Chandra Bose Shikshan Sankul Sector 20 Gandhinagar Sector-20, Gandhinagar, District nan, Gujarat",382021.0,Gujarat,2(f),State Uni.csv,,,,,,,,,,State_770,23.2186198,72.64311459999999,80,2,1.0,google
76.0,State,Chhatrapati Shahu Ji Maharaj University,"Kalyanpur, Kanpur, District nan, Uttar Pradesh",208024.0,Uttar Pradesh,2(f) & 12(B),State Uni.csv,,,,,,,,,,State_767,26.510822,80.24686609999999,80,2,0.6,google
78.0,State,Chhattisgarh Swami Vivekanad Technical Universty,"North Park Avenue, Sector-8Bhilai, DurgChatisgarh, District nan, Chhattisgarh",490009.0,Chhattisgarh,2(f) & 12(B),State Uni.csv,,,,,,,,,,State_769,21.1932533,81.3191546,80,2,0.8500000000000001,google
52.0,State,Bihar Agricultural University,"Sabour BhagalPur, District nan, Bihar",813210.0,Bihar,2(f),State Uni.csv,,,,,,,,,,State_743,25.2442186,87.04515669999999,80,2,0.6,google
53.0,State,Bihar Animal Sciences University,"Bihar Veterinary College Campus, Patna, District nan",800014.0,Bihar,2(f),State Uni.csv,,,,,,,,,,State_744,25.5999306,85.0848654,80,2,0.8,google
54.0,State,Bihar Engineering University,"6th Floor, Examination Block, AKU Campus, Mithapur, Patna, District nan, Bihar",800001.0,Bihar,2(f),State Uni.csv,,,,,,,,,,State_745,25.5923023,85.1349288,80,2,0.8,google
55.0,State,Bihar University of Health Sciences,"Mithapur, Patna, District nan, Bihar",800001.0,Bihar,2(f),State Uni.csv,,,,,,,,,,State_746,25.5955281,85.1368911,80,2,0.6,google
56.0,State,Biju Patnaik University of Technology,"Chhend Colony, Rourkela, District nan, Odisha",769015.0,Odisha,2(f),State Uni.csv,,,,,,,,,,State_747,22.2418318,84.8186645,80,2,0.6,google
57.0,State,Bikaner Technical University,"RIICO Karni Industrial Area, Pugal Road, Bikaner, District nan, Rajasthan",334004.0,Rajasthan,2(f),State Uni.csv,,,,,,,,,,State_748,28.0488143,73.2811927,80,2,0.8500000000000001,google
