"195","State","Jawaharlal Nehru Technological University (Kainada)","Pitapuram Road, JNTU Kakinada, Kainada, Dist. East Godavari","533003","Andhra Pradesh","2(f) & 12(B)"
"196","State","Jharkhand Raksha Shakti University","Old Judicial Academy(Shri Krishna Lok Prashashan Sansthan Parisar)Mayors Road, Ranchi","834002","Jharkhand","2(f)"
"197","State","Jharkhand State Open University","Kanke, Ranchi","834006","Jharkhand","2(f)"
"198","State","Jharkhand University of Technology","Science & Technology Campus,Sirkha Toll, Namkum,Ranchi","834010","Jharkhand","2(f)"
"199","State","Jiwaji University","GwaliorPIN - 474 001. (MP)","","Madhya Pradesh","2(f) & 12(B)"
"200","State","Junagarh Agricultural University","Junagarh","362 001","Gujarat","2(f)"
"201","State","Kakatiya University","Kakatiya University,Warangal, Vidyaranyapuri,PIN - 506 009.","","Telangana","2(f) & 12(B)"
"202","State","Kalahandi University","Manikya Vihar, Bhawanipatna, Dist.-Kalahandi","766001","Odisha","2(f)"
"203","State","Kaloji Narayana Rao University of Health Sciences","Kakatiya Medical College Campus, Rangampet, Warangal (U)","506007","Telangana","2(f)"
"204","State","Kalyani University","Kalyani","","West Bengal","2(f) & 12(B)"
"205","State","Kamdhenu University","B-1 Wing, 4th Floor, Karmayogi Bhavan, Sector 10A Gandhinagar GujaratSector 10 A, Block B,Podium Level, Gandhinagar","382410","Gujarat","2(f)"
"206","State","Kameshwar Singh Darbhanga Sanskrit Vishwavidyalaya","Kameshwar Nagar, Darbhanga","846008","Bihar","2(f) & 12(B)"
"207","State","Kannada University","Vidyaranya, Hosapete Taluk, Bellary Dist., KARNATAKAHampi (Dt. Bellary) 583276","583276","Karnataka","2(f) & 12(B)"
"208","State","Kannur University","MangattuparambaDistt- Kannur","670 567","Kerala","2(f) & 12(B)"
"209","State","Kanyashree University","Krishnanagar,Nadia","","West Bengal","2(f)"
"210","State","Karmaveer Bhaurao Patil University","Powai Naka, Satara","415001","Maharashtra","2(f)"
"211","State","Karnatak  University","Karnatak University,Pavate Nagar, Dharwad","580003","Karnataka","2(f) & 12(B)"
"212","State","Karnataka  State Law University","Navanagar, Hubli-580025Karnataka","","Karnataka","2(f) & 12(B)"
"213","State","Karnataka  State Open University","ManasangangotriMysore-570006","","Karnataka","2(f) & 12(B)"
"214","State","Karnataka Folklore University","Gotagodi, Shiggavi Taluk, Haveri District - 581 205Vijayanagar, Banglore","581205","Karnataka","2(f)"
"215","State","Karnataka Janapada Vishwavidyalaya","Gatagodi, NH-4, TalukShiggaon, Dist-Haveri,","581197","Karnataka","2(f)"
"216","State","Karnataka Samskrit University","Sri Chamarajendra Sanskrit College campus,Pampa Mahakavi Road,ChamarajpetBangalore","580018","Karnataka","2(f) & 12(B)"
"217","State","Karnataka State Akkamahadevi Women University (Formerly ""Karnataka State Women's University)","Jnanashakthi Campus, Athani Road, Toravi, Vijayapura,","586108","Karnataka","2(f) & 12(B)"
"218","State","Karnataka State Rural Development and Panchayat Raj University","Raitha Bhavana, General Cariappa Circle, Gadag, Karnataka- 582101Regional Office:- Grameenabhivruddhi Bhavan, Ananda Rao Circle,Bengaluru-560009","582101","Karnataka","2(f)"
"219","State","Karnataka Veterinary, Animal & Fisheries Science University","NandinagarPB No.6,Bidar-585401(Karnataka","585226","Karnataka","2(f)"
"220","State","Kashmir University","Hazratbal, SrinagarPIN - 190 006. (J & K)","190006","Jammu and Kashmir","2(f) & 12(B)"
"221","State","Kavayitri Bahinabai Chadhari North Maharashtra University","UmavinagarP.B.No.80, Jalgaon","425001","Maharashtra","2(f) & 12(B)"
"222","State","Kavi Kulguru Kalidas Sanskrit Vishwavidyalaya","Administration Building, Mouda Road, Ramtek, Dist. Nagpur Ramtek-441106,Dist. NagpurMaharashtra","441106","Maharashtra","2(f) & 12(B)"
"223","State","Kazi Nazrul University","Nazrul Road, Kalla Bypass MorePO – Kalla, C. H., P. s. Asansol (North)Dist. Paschim Bardhman","713 304","West Bengal","2(f) & 12(B)"
"224","State","Keladi Shivappa Nayaka University of Agriculture and Horticultural Sciences","Shivamogga, Iruvakki, Sagara Taluk, Shivamogga District","577412","Karnataka","2(f)"
"225","State","Kerala Agricultural Unviersity","Kerala Agricultural University KAU Main Campus KAU P.O., Vellanikkara, Thrissur, Kerala, 680656Thrissur - 680 654.","680656","Kerala","2(f) & 12(B)"
"226","State","Kerala University","Thiruvananthapuram - 695 0","","Kerala","2(f) & 12(B)"
"227","State","Kerala University of Digital Sciences Innovation and Technology","Technology CampusKuracode, MangalapurammThonnakkal P.O., Thiruvananthapuram","695317","Kerala","2(f)"
"228","State","Kerala University of Fisheries & Ocean Studies","Panangad P.O, Kochi Kochi","682506","Kerala","2(f) & 12(B)"
"229","State","Kerala University of Health Sciences","Trissur","680596","Kerala","2(f)"
"230","State","Kerala Veterinary & Animal Sciences University","Kerala Veterinary and Animal Sciences University, Pookode, Wayanad, KeralaWayanad","673576","Kerala","2(f)"
"231","State","Khallikote Unitary University","Sundar Nagar, Ganjam, Berhampur","760001","Odisha","2(f)"
"232","State","Khangchendzonga State University (Formerly Sikkim State University)","Nar Bahadur Bhandari Government College Complex, PO Tadong, Gangtok, East Sikkim","737102","Sikkim","2(f)"
"233","State","Khwaja Moinuddin Chishti Language University","Sitapur - Hardoi Bypass Road,Near I.I.M.Lucknow","226013","Uttar Pradesh","2(f) & 12(B)"
"234","State","King Georges Medical University","King George Medical University, Shahmeena Road Chowk, Lucknow,","226003","Uttar Pradesh","2(f) & 12(B)"
"235","State","Kodagu University","Chikka Aluvara, Kushalnagar","571232","Karnataka","2(f)"
"236","State","Kolhan University","NH-75, WEST SINGHBHUM, JHARKHANDWest Singhbhum, Jharkhand","833202","Jharkhand","2(f)"
"237","State","Konkan Krishi Vidyapeeth","Dapoli, Tal: Dapoli, Dist. RatnagiriDistrict Ratnagiri","415712","Maharashtra","2(f) & 12(B)"
"238","State","Koppal University","Government Engineering College, Talakala, Dist. Koppal","583231","Karnataka","2(f)"
"239","State","Krantiguru Shyamji Krishna Verma Kachchh University","Mundra road bhuj kachchhBhuj-Kachchh, Gujarat","370001","Gujarat","2(f) & 12(B)"
"240","State","Krishna Kanta Handiqui State Open University","Resham Nagar,Khanapara, Kamrup(M),Guwahati","781022","Assam","2(f)"
"241","State","Krishna University","Andhra JateeyaKalasala, Campus, RajupetaMachllipatanam","521001","Andhra Pradesh","2(f)"
"242","State","KSGH Music and Performing Arts University","Jlb road, Ashoka Circle, Lakshmipura, Mysuru-04Near Ashoka CircleLadshmipuram, Mysore","570004","Karnataka","2(f)"
"243","State","Kumar Bhaskar Varma Sanskrit & Ancient Studies University","NAMATI, HATI NAMATI, NALBARI, ASSAM-781337, INDIAP.O.- Hati NamatiDist-Nalbari,Assam","781337","Assam","2(f) & 12(B)"
"244","State","Kumaun University","Sleepy Hallow,Mallital,Nainital","263001","Uttarakhand","2(f) & 12(B)"
"245","State","Kurukshetra University","KurukshetraPIN - 136 119  (HARYANA)","136119","Haryana","2(f) & 12(B)"
"246","State","Kushabhau Thakre Patrakarita Avam Jansanchar Vishwavidyalaya","At: Kathadih, Po: Sunder Nagar, Raipur","492013","Chhattisgarh","2(f)"
"247","State","Kuvempu University","Jnanasahyadri, Shankaraghatta, Shivamogga, KarnatakaPIN -577 451. KARNATAKA.","577451","Karnataka","2(f) & 12(B)"
"248","State","Lala Lajpat Rai University of Veterinary & Animal Sciences","CCSHAU Campus","125004","Haryana","2(f) & 12(B)"
"249","State","Lalit Narayan Mithila University","Darbhanga","846008","Bihar","2(f) & 12(B)"
"250","State","Laxminarayan Innovation Technological (LIT) University","LITU Campus, Amaravati Road, Nagpur","440033","Maharashtra","2(f)"
"251","State","M.B.M. University","Ratanada, Jodhpur","342011","Rajasthan","2(f)"
"252","State","M.P.Bhoj (open) University","Kolar Road BhopalKolar Road,Bhopal","462016","Madhya Pradesh","2(f) & 12(B)"
"253","State","Maa Shakumbhari University","Saharanpur, PunwarkaSaharanpur","247120","Uttar Pradesh","2(f)"
"254","State","Madan Mohan Malaviya University of Technology","Deoria Road Gorakhpur","273010","Uttar Pradesh","2(f) & 12(B)"
"255","State","Madhabdev University","Narayanpur, PO: Dikrong, Lakhimpur, AssamNarayanpur,Lakhimpur","784164","Assam","2(f)"
"256","State","Madhusudan Law University","Station Road, Cuttack","750003","Odisha","2(f)"
"257","State","Madhya Pradesh Medical Science University","NSCB Medical College Campus, Bhedaghat Road, Jabalpur","482003","Madhya Pradesh","2(f)"
"258","State","Madras University","ChepaukChennai","","Tamil Nadu","2(f) & 12(B)"
"259","State","Madurai Kamraj University","Palkainagar,Madurai-625 021.(T.N.).","","Tamil Nadu","2(f) & 12(B)"
"260","State","Magadh University","Bodh Gaya","824234","Bihar","2(f) & 12(B)"
"261","State","Maharahtra University of Health Sciences","Vani Dindori Road, Mhasrul, NashikNashik-422 005","422004","Maharashtra","2(f)"
"262","State","Maharaja Bir Bikram University","AgartalaTripura","","Tripura","2(f) & 12(B)"
"263","State","Maharaja Chhatrasal Bundelkhand Vishwavidyalaya","GOVT MAHARAJA COLLEGE CAMPUS","471001","Madhya Pradesh","2(f)"
"264","State","Maharaja Ganga Singh University","NH-15, Jaisalmer Road, Bikaner","334004","Rajasthan","2(f)"
"265","State","Maharaja Krishnakumarsinji Bhavnagar University","S.V. Patel Campus,Gaurishanker Lake Road,Bhavnagar","364 001","Gujarat","2(f)"
"266","State","Maharaja Ranjit Singh Punjab Technical University","Dabwali Rd, Lal Singh Nagar, Bathinda","151001","Punjab","2(f) & 12(B)"
"267","State","Maharaja Sayajirao University of Baroda","Head Office, Maharaja Fatehsinghrao Gaekwad Road,Fatehgunj,Vadodara","390002","Gujarat","2(f) & 12(B)"
"268","State","Maharaja Sriram Chandra Bhanja Deo University(Earlier North Orissa University)","Sriram Chandra Vihar, Takatpur, Baripada, Bhuabaneswar","757003","Odisha","2(f) & 12(B)"
"269","State","Maharaja Suhel Dev State University","Raidopur, Azamgarh","276001","Uttar Pradesh","2(f)"
"270","State","Maharaja Surajmal Brij University","Chak Sakitara, Kumher, Bharatpur","321201","Rajasthan","2(f)"
"271","State","Maharana Partap Horticultural University","Karnal","132001","Haryana","2(f)"
"272","State","Maharana Pratap University of Agriculture & Technology","Maharana Pratap University of Agriculture & Technology, Udaipur 313001Udaipur-313001","313001","Rajasthan","2(f)"
"273","State","Maharani Cluster University","Palace Road Bangalore Bengaluru","560001","Karnataka","2(f)"
"274","State","Maharashtra Animal & Fishery Sciences University","Futala Lake Road, NagpurSeminary Hills, Nagpur-440 006","440001","Maharashtra","2(f)"
"275","State","Maharashtra National Law University, Aurangabad","Paithan Road, Kanchanwadi, Aurangabad","431005","Maharashtra","2(f)"
"276","State","Maharashtra National Law University, Mumbai","CETTM MTNL Building, Hiranandani Gardens, Powai, Mumbai","400076","Maharashtra","2(f)"
"277","State","Maharashtra National Law University, Nagpur","Training Institute(JOTI), Civil Lines,  C P Club Road, Nagpur","440001","Maharashtra","2(f) & 12(B)"
"278","State","Maharashtra State Skills University","1st, Floor, Elphinstone Technical High School3, Mahapalika Marg, Metro ChowkMumbai","400001","Maharashtra","2(f)"
"279","State","Maharishi Balmiki Sanskrit University","Mundri,Kaithal","136027","Haryana","2(f)"
"280","State","Maharshi Dayanand Saraswati University","Pushkar Bye PassAjmer","305001","Rajasthan","2(f) & 12(B)"
"281","State","Maharshi Dayanand University","Rohtak","124001","Haryana","2(f) & 12(B)"
"282","State","Maharshi Panini Sanskrit Evam Vedic Vishwavidyalaya","Dewas Road, Ujjain,  Madhya Pradesh","456010","Madhya Pradesh","2(f)"
"283","State","Mahatam Gandhi Kashi Vidyapeeth","Varanasi-221 002 (U.P)","","Uttar Pradesh","2(f) & 12(B)"
"284","State","Mahatma Gandhi Chitrakoot Gramodaya Vishwavidyalaya","ChitrakootDistrict Satna","485334","Madhya Pradesh","2(f) & 12(B)"
"285","State","Mahatma Gandhi Udyanikee and Vanikee Vishwavidyalaya","Sankra-PatanDistrict- Durg","491111","Chhattisgarh","2(f)"
"286","State","Mahatma Gandhi University","Post. Yellareddygudem Panagal, Nalgonda","508 254","Telangana","2(f) & 12(B)"
"287","State","Mahatma Gandhi University","Mahishadal, Purba Medinipur","721628","West Bengal","2(f)"
"288","State","Mahatma Gandhi Unversity","Kottayam,PIN - 686 560. (KERALA).","","Kerala","2(f) & 12(B)"
"289","State","Mahatma Jyotiba Phule Rohilkhand University","Doli Lal Agarwal Marg,Bareilly","","Uttar Pradesh","2(f) & 12(B)"
"290","State","Mahatma Phule Krishi Vidyapeeth","RahuriDt.Ahmednagar - 413 722.","","Maharashtra","2(f) & 12(B)"
"291","State","Majuli University of Culture","Patharichuk N.C,Majuli","787054","Assam","2(f)"
"292","State","Makhanlal Chaturvedi National University of Journalism & Communication","B-38, Vikas Bhavan, Press Complex, MP Nagar, Zone-1Bhopal","462 011","Madhya Pradesh","2(f) & 12(B)"
"293","State","Mandya University","M.C. Road,Mandya","571401","Karnataka","2(f)"
"294","State","Mangalore University","Mangalore University Mangalagangotri Karnataka State IndiaMangalore - 574 199.","574199","Karnataka","2(f) & 12(B)"
"295","State","Manipur Technical University","Takyelpat, Imphal, Manipur","795004","Manipur","2(f)"
"296","State","Manipur University of Culture","Palace Compound, Imphal East, Manipur","795001","Manipur","2(f)"
"297","State","Manonmaniam Sundarnar University","Tirunelvelli - 627 008.","","Tamil Nadu","2(f) & 12(B)"
"298","State","Marathwada Agricultural University","Basmat Road, Parbhani","431402","Maharashtra","2(f) & 12(B)"
"299","State","Maulana Abul Kalam Azad University of Technology","BF-142, Sector-1, Salt Lake city,Sector-I, Kolkata","700064","West Bengal","2(f) & 12(B)"
"300","State","Maulana Mazharul Haque Arabic & Persian University","3 Polo Road, Patna","800001","Bihar","2(f)"
"301","State","Mohanlal Sukhadia University","Udaipur","313 001","Rajasthan","2(f) & 12(B)"
"302","State","Mother Teresa Women's University","Registrar, Mother Teresa Women's University, Attuvampatty, Kodaikanal.T.N. - 624 101.","624101","Tamil Nadu","2(f) & 12(B)"
"303","State","Mumbai University","M.G. Road, Fort, Mumbai Mumbai - 400 032.","400032","Maharashtra","2(f) & 12(B)"
"304","State","Munger University","Munger","811201","Bihar","2(f)"
"305","State","Murshidabad University","1,No. Sahid Surya Sen RoadP.O.-Berhampore,District Murshidabad","742101","West Bengal","2(f)"
"306","State","Mysore University","Manasagangotri, Mysuru,  KarnatakaMysore - 570 005.","570006","Karnataka","2(f) & 12(B)"
"307","State","Nalanda Open University","Biscomum Bhawan, West, Gandhi Maidan,  Patna","800001","Bihar","2(f)"
"308","State","Nanaji Deshmukh Pashu Chikitsa Vigyan Vishwavidyalaya","Adhartal, Jabalpur-482004, Madhya PradeshJabalpur","482004","Madhya Pradesh","2(f)"
"309","State","National Academy of Legal Studies & Research University","Justice City, Shameerpet, Medchal District, Telangana State, India","500101","Telangana","2(f) & 12(B)"
"310","State","National Law Institute University","Kerwa Dam Road, BhopalBarkeri KalanBhopal","462044","Madhya Pradesh","2(f) & 12(B)"
"311","State","National law School of India University","Nagarbhavi, BengaluruBangalore - 560 072.","560072","Karnataka","2(f) & 12(B)"
"312","State","National Law University","NH-65, Nagour Road MandoreJodhpur","342304","Rajasthan","2(f) & 12(B)"
"313","State","National Law University","Kathajodi Campus, Sec – 13, Cuttack","753015","Odisha","2(f) & 12(B)"
"314","State","National Law University","Sector-14, Dwarka","110078","Delhi","2(f) & 12(B)"
"315","State","National Law University and Judicial Academy","Hajo Road, Amingaon, Kamrup (Rural), AssamBholanath Mandir Parh, UlubariGuwahati","781031","Assam","2(f) & 12(B)"
"316","State","National Law University Tripura","Narsingarh,Tripura","799 009","Tripura","2(f)"
"317","State","National University of Advanced Legal Studies (NUALS)","HMT Colony P.O., Kalamassery, KochiKochi-682017, Kerala","683503","Kerala","2(f) & 12(B)"
"318","State","National University of Study & Research in Law","P.O. Bukru, Kanke Pithoria Road, Kanke - Nagari, Kanke, RanchiBIT Mesra,Ranchi","834006","Jharkhand","2(f)"
"319","State","Navsari Agriculture University","Navsari Agricultural University, Eru Char Rasta, Dandi Road, Navsari – 396 450 (Gujarat) INDIA","396450","Gujarat","2(f)"
"320","State","Netaji Shubhash Open University","DD-26, Salt Lake, Sector-1, Kolkata","700064","West Bengal","2(f) & 12(B)"
"321","State","Netaji Subhas University of Technology","Sector 3, Dwarka","110078","Delhi","2(f) & 12(B)"
"322","State","Nilamber-Pitamber University","Madininager, Palamu-822101Jharkhand","","Jharkhand","2(f)"
"323","State","Nizam's Institute of Medical Sciences","Punjagutta, Hyderabad","500082","Telangana","2(f)"
"324","State","Nrupathunga University","Nrupathunga Road, Bengaluru,","","Karnataka","2(f)"
"325","State","Odia University","Satyabdi, Puri","752014","Odisha","2(f)"
"326","State","Odisha State Open University","G.M. University Campus, Budharaja, Sambalpur","768004","Odisha","2(f)"
"327","State","Odisha University Of Agriculture & Technology","Surya Nagar, Bhubaneswar","751003","Odisha","2(f) & 12(B)"
"328","State","Odisha University of Health Sciences","Sishu Bhawan Square, Bhubaneswar","751009","Odisha","2(f)"
"329","State","Odisha University of Technology and Research","Kalinga Nagar, Ghatikia, P.O. Mahalaxmi Vihar, Bhubaneswer","751003","Odisha","2(f)"
"330","State","Osmania University","Administrative Building Osmania University Campus Hyderabad-500007, Telangana State, India.PIN - 500 007.","500007","Telangana","2(f) & 12(B)"
"331","State","P. V. Narsimha Rao Telangana Veterinary University","Administrative Office, Rajendranagar, Hyderabad","500030","Telangana","2(f)"
"332","State","Palamuru University","Ayyappa ComplexOpp. Police Head Quarters,Mahabubnagar-509001","","Telangana","2(f)"
"333","State","Pandit Deendayal Upadhyaya Shekhawati University","Nawalgarh Rd, Katrathal, Sikar","332 001","Rajasthan","2(f)"
"334","State","Pandit S N Shukla University","Nawalpur, Shahdol, M.P.","484001","Madhya Pradesh","2(f) & 12(B)"
"335","State","Pandit Sundarlal Sharma (Open) University","Koni Birkona Road, Bilaspur, Chhattisgarh, Bilaspur-495001Chhattisgarh","495009","Chhattisgarh","2(f)"
"336","State","Panjab University","Sector-14/25Chandigarh","160014","Chandigarh","2(f) & 12(B)"
"337","State","Patliputra University","Kankarbagh Road, Near Rajendra Nagar Terminal, Patna","800020","Bihar","2(f)"
"338","State","Patna University","Patna","800005","Bihar","2(f) & 12(B)"
"339","State","Periyar University","Periyar Palkalai Nagar,Salem-11Campus,  Salem- 636 011 (T.N.)","636011","Tamil Nadu","2(f) & 12(B)"
"340","State","Potti Sreeramulu Telugu University","Lalitakala -KshetramHyderabad-500004","","Telangana","2(f) & 12(B)"
"341","State","Presidency University","86/1, College Street, KolkataKolkata","700073","West Bengal","2(f) & 12(B)"
"342","State","Prof. Rajendra Singh (Rajju Bhaiya) University (Formerly Allahabad State University)","Prayagraj,Mirzapur Road, Naini,Prayagraj","211009","Uttar Pradesh","2(f)"
"343","State","Professor Jayashankar Telangana State Agricultural University","Administrative Office, Rajendranagar, Hyderabad","500030","Telangana","2(f) & 12(B)"
"344","State","Pt. Bhagwat Dayal Sharma University of Health Sciences","Rohtak-124001Haryana","","Haryana","2(f) & 12(B)"
"345","State","Pt. Ravishankar Shukla University","Pt. Ravishankar Shukla University, Amanaka G. E. Road Raipur, C.G.Chattisgarh","492010","Chhattisgarh","2(f) & 12(B)"
"346","State","Puducherry Technological University","Pillaichavady, Puducherry","605014","Puducherry","2(f)"
"347","State","Punjab Agriculture University","Ludhiana","141004","Punjab","2(f) & 12(B)"
"348","State","Punjabi University","Rajpura road,  Patiala","147002","Punjab","2(f) & 12(B)"
"349","State","Punyashlok Ahilyadevi Holkar Solapur University","Kegaon, Solapur-Pune National Highway, Solapur-413255, Maharashtra (India)Solapur Pune national HighwayKegaon,Solapur-413255 (Maharashtra)","413255","Maharashtra","2(f) & 12(B)"
"350","State","Purnea University","Purnea","854301","Bihar","2(f)"
"351","State","Rabindra Bharati University","56A, B.T. ROAD, KOLKATA - 700 050Kolkata - 700 050.","700050","West Bengal","2(f) & 12(B)"
"352","State","Rabindranath Tagore University","Hojai,Hojai district","782435","Assam","2(f)"
"353","State","Raichur University","Jnana Tunga CampusYegrageraRaichur","584133","Karnataka","2(f)"
"354","State","Raiganj University","P.O. Raiganj,Dist. Uttar DinajpurWest Bengal","733134","West Bengal","2(f) & 12(B)"
"355","State","Raj Rishi Bhartrihari Matsya University","abu Shobha Ram Govt. Arts College Campus, Alwar","301001","Rajasthan","2(f)"
"356","State","Raja Mahendra Pratap Singh State University","Palwal Road, Lodha, Aligarh","202140","Uttar Pradesh","2(f)"
"357","State","Raja Mansingh Tomar Music & Arts University","Mahadaji ChowkAchaleshwar MargGwalior","474 009","Madhya Pradesh","2(f)"
"358","State","Raja Shankar Shah University, Chhindwara","Library building of Government Autonomous Post Graduate College,Chhindwara,","480001","Madhya Pradesh","2(f)"
"359","State","Rajasthan Ayurveda University","City office,82, Income Tax Col.Paota'C'Road, Jodhpur","","Rajasthan","2(f)"
"360","State","Rajasthan Technical University","Rawat bhata RoadKota-324 010, Rajasthan","","Rajasthan","2(f)"
"361","State","Rajasthan University","J L N MargPIN - 302 004.","302004","Rajasthan","2(f) & 12(B)"
"362","State","Rajasthan University of Health Sciences","Kumbha Marg, Pratap Nagar,Sector-18, Tonk Road,Sanganer, Jaipur","302033","Rajasthan","2(f) & 12(B)"
"363","State","Rajasthan University of Veterinary & Animal Sciences","Vijay Bhawan Palace Complex, Veterinary University Road, Bikaner","334001","Rajasthan","2(f) & 12(B)"
"364","State","Rajendra University","Prajna Vihar, Balangir","767002","Odisha","2(f)"
"365","State","Rajiv Gandhi Prodoyogiki Vishwavidyalaya","Airport BypassGandhi NagarBhopal (M.P.)","462036","Madhya Pradesh","2(f) & 12(B)"
"366","State","Rajiv Gandhi University of Health Science","JayanagarBangalore - 560 041.","","Karnataka","2(f)"
"367","State","Rajiv Gandhi University of Knowledge Technologies","V. R. Mansions, Kunchanapalli, Guntur District","522501","Andhra Pradesh","2(f)"
"368","State","Rajiv Gandhi University of Knowledge Technology","RGUKT BASAR, MA:BASAR, DT:NIRMAL, TELANGANA, PIN 504107IIIT-H Campus, GachibowliHyderabad","504107","Telangana","2(f) & 12(B)"
"369","State","Rajmata Vijayaraje Scindia Krishi Vishwa Vidyalaya","Opp. Mela GroundRace Course RoadGwalior,Madhya Pradesh","474 002","Madhya Pradesh","2(f)"
"370","State","Rama Devi Women's University","Vidya Vihar, Bhoi Nagar, Bhubaneswar","751022","Odisha","2(f) & 12(B)"
"371","State","Ranchi University","Ranchi,PIN - 834 008. (JHARKHAND)","","Jharkhand","2(f) & 12(B)"
"372","State","Rani Channamma University","Rani Channamma University, Vidyasangama Campus, Bhutaramanahatti, PB-NH 04,  Belagavi-Karnataka-IndiaP.B Highway,Belagavi","591156","Karnataka","2(f) & 12(B)"
"373","State","Rani Durgavati Vishwavidyalaya","Jabalpur - 482 001. (M.P)","","Madhya Pradesh","2(f) & 12(B)"
"374","State","Rani Rashmoni Green University(formerly West Bengal Green University.)","At the premises of Singur General Degree College, Singur, Hooghly, West Bengal","712409","West Bengal","2(f)"
"375","State","Rashtrasant Tukadoji Maharaj Nagpur University","Chhatrapati Shivaji Maharaj Administrative Premises,Ravindranath Tagore Marg,Nagpur","440001","Maharashtra","2(f) & 12(B)"
"376","State","Ravenshaw University","Cuttack","753003","Odisha","2(f) & 12(B)"
"377","State","Rayalaseema University","Nandyala Road,Kurnool","518002","Andhra Pradesh","2(f) & 12(B)"
"378","State","Sadhu Ram Chand Murmu University of Jhargram( formerly Jhargram University)","Jhargram Raj College, Jhagram","721507","West Bengal","2(f)"
"379","State","Sambalpur University","Jyoti Vihar, Burla, Sambalpur","768019","Odisha","2(f) & 12(B)"
"380","State","Sampurnanand Sanskrit Vishwavidyalaya","Varanasi - 221 002. (UP)","","Uttar Pradesh","2(f) & 12(B)"
"381","State","Sanchi University of Buddhist-Indic Studies","2nd Floor, Institute of Good Governance & Policy AnalysisBhadbhada Square,Bhopal","462003","Madhya Pradesh","2(f) & 12(B)"
"382","State","Sant Gadge Baba Amravati University","Camp, ti,Amravati-444602(M.S.)","","Maharashtra","2(f) & 12(B)"
"383","State","Sant Gahira Guru Vishwavidyalaya (formerly Sarguja University)","Sant Gahira Guru VishwavidyalayaSarguja-Ambikapur- Darripara, Hospital Road Ambikapur Distt. Surguja","497001","Chhattisgarh","2(f)"
"384","State","Sardar Beant Singh State University","Pathankot Road, Bariar, Gurdaspur","143521","Punjab","2(f)"
"385","State","Sardar Krushinagar Dantiwada Agricultural University","Sardarkrushinagar Dantiwada Agricultural University, Sardarkrushinagar- 385 506, District. Banaskantha (Gujarat)Dist. Banaskantha","385506","Gujarat","2(f)"
"386","State","Sardar Patel University","Near Saheed Chowk, Nana Bazar, Vallabh Vidyanagar, Anand, GujaratAnand-388 120. (GUJARAT)","388120","Gujarat","2(f) & 12(B)"
"387","State","Sardar Patel University Mandi","Vallabh Government College CampusAdministrative BlockMandi Sadar, Mandi","175001","Himachal Pradesh","2(f)"
"388","State","Sardar Patel University of Police, Security & Criminal Justice","Opp. Gramin Police line, Mathania Road, Daijar, Jodhpur","342304","Rajasthan","2(f)"
"389","State","Sardar Vallabh Bhai Patel University of Agriculture & Technology","Modipuram, Meerut,  U.P-250110","","Uttar Pradesh","2(f)"
"390","State","Satavahana University","SATAVAHANA UNIVERSITY, MALKAPUR ROAD, KARIMNAGAR, TELANGANA STATEAndhra Pradesh-505001","505002","Telangana","2(f)"
"391","State","Saurashtra University","Kalavad RoadRajkot Gujarat","360 005","Gujarat","2(f) & 12(B)"
