"392","State","Savitribai Phule Pune University","Ganeshkhind Road,  Pune, Maharashtra, India.Pune","411007","Maharashtra","2(f) & 12(B)"
"393","State","Shaheed Bhagat Singh State University","Moga Road, Firozpur","152001","Punjab","2(f)"
"394","State","Shaheed Mahendra Karma Vishvidyalaya","Dharampura 2, Jagdalpur, Distt. Bastar, ChhattisgarhChhattisgarh -494005","494001","Chhattisgarh","2(f)"
"395","State","Shaheed Nandkumar Patel Vishwavidyalaya","Garhumaria, Odisha Road,Raigarh","496001","Chhattisgarh","2(f)"
"396","State","Sher-e-Kashmir University of Agricultural Science & Technology","Shalimar, srinagar J and K Srinagar-190 001. (J&K)","190025","Jammu and Kashmir","2(f) & 12(B)"
"397","State","Sher-e-Kashmir University of Agricultural Science & Technology, Jammu","Jammu","","Jammu and Kashmir","2(f)"
"398","State","Shivaji University","Vidyanagar KolhapurKolhapur - 416 004.","416004","Maharashtra","2(f) & 12(B)"
"399","State","Shree Sankaracharaya University of Sanskrit","P.B.No. 14, Kalady District,ErnakulamKalady","","Kerala","2(f) & 12(B)"
"400","State","Shree Somnath Sanskrit University","Ta: VeravalDistrict Junagarh","","Gujarat","2(f) & 12(B)"
"401","State","Shri Govind Guru University","Government Polytechnic Campus, RTO Road, Gadukpur, Godhra, Dist. Panchmahal (Gujarat)-389001 Gadukpur,Godhra,Dist. Panchmahals","389001","Gujarat","2(f)"
"402","State","Shri Jagannath Sanskrit Vishwavidyalaya","Shikha Rd, Penthakata, Puri","752003","Odisha","2(f) & 12(B)"
"403","State","Shri Krishna AYUSH University","Umri Road, Sector-8,Kurukshetra","","Haryana","2(f)"
"404","State","Shri Mata Vaishno Devi University","SMVD University, Kakryal, Katra, J&KKatra,J&K","182320","Jammu and Kashmir","2(f) & 12(B)"
"405","State","Shri Vishwakarma Skill University","Dudhola, Palwal","121102","Haryana","2(f)"
"406","State","Sibsagar University","P.O. Joysagar, Dist. Sivasagar","785665","Assam","2(f)"
"407","State","Siddharth University","Siddharth University Kapilvastu, Siddharth NagarSiddharth Nagar","272202","Uttar Pradesh","2(f)"
"408","State","Sidho-Kanho-Birsha University","Sidho-Kanho-Birsha University, Rachi Road, PO- Sainik School, Dist.- Purulia, PIN-723104, West BengalRanchi Road Campus,Near Sainik School,Purulia","723104","West Bengal","2(f) & 12(B)"
"409","State","Sido Kanhu Murmu University","Dighi Campus, Dumka - Pakur Road, Dumka Dumka,","814110","Jharkhand","2(f) & 12(B)"
"410","State","Sikkim National Law University","Sikkim Government Law CollegeBurtuk(Campus)Gangtok","737101","Sikkim","2(f)"
"411","State","Smt. Nathibai Damodar Thackersey Women's University","1,Nathibai Thackersay Rd.Mumbai - 400 020.","","Maharashtra","2(f) & 12(B)"
"412","State","Soban Singh Jeena University","Almora","","Uttarakhand","2(f)"
"413","State","Sports University of Haryana","Near 20th Mile Stone (Biswa-Mile), NH-44, Rai, Sonipat","131029","Haryana","2(f)"
"414","State","Sree Narayanguru Open University","Kollam","691601","Kerala","2(f)"
"415","State","Sri Dev Suman Uttarakhand Vishwavidyalaya","Badshahithaul, Tehri Garhwal","249 199","Uttarakhand","2(f)"
"416","State","Sri Guru Teg Bahadur State University of Law","Sarhali Rd, Patti, District, Tarn Taran","143416","Punjab","2(f)"
"417","State","Sri Konda Laxman Telangana State Horticultural University","Mulugu, Siddipet district, Hyderabad","502279","Telangana","2(f)"
"418","State","Sri krishnadevaraya University","Sri Venkateswarpuram,Anantapuram","515003","Andhra Pradesh","2(f) & 12(B)"
"419","State","Sri Padmavati Mahila Vishwavidyalayam","Padmavathi Nagar, Tirupati,  Chittoor (Dist)","517502","Andhra Pradesh","2(f) & 12(B)"
"420","State","Sri Sri Aniruddhdeva Sports University","DICC BUILDING, 2ND FLOOR, ChabuaNEAR DISTRICT LIBRARY, DISTT. DIBRUGARH, Dibrugarh","786003","Assam","2(f)"
"421","State","Sri Venkateswara Institute of Medical Sciences","Alipiri Road, Tirupati, Chittoor Dist","517507","Andhra Pradesh","2(f) & 12(B)"
"422","State","Sri Venkateswara University","Tirupati","517502","Andhra Pradesh","2(f) & 12(B)"
"423","State","Sri Venkateswara Vedic University","Alipiri-Chandragiri Bypass Road, Tirupati, Chittoor Dist","517502","Andhra Pradesh","2(f)"
"424","State","Sri Venkateswara Veterinary University","Dr. YSR Bhavan, Tirupati","517502","Andhra Pradesh","2(f) & 12(B)"
"425","State","Srimanta Sankaradeva University of Health Sciences","Narakasur Hilltop, BhangagarhGuwahati","781032","Assam","2(f)"
"426","State","Swami Keshwanand Rajasthan Agricultural University","Beechwal, Sriganganagar Road,Bikaner","","Rajasthan","2(f)"
"427","State","Swami Ramanand Teerth Marathwada University","Vishnupuri, Nanded","431606","Maharashtra","2(f) & 12(B)"
"428","State","Swarnim Gujarat Sports University","Commerce College Campus, Opp Youth Hostel, Sector 15, Gandhinagar, Gujarat PTC Building Campus, Gandhinagar","382016","Gujarat","2(f)"
"429","State","T.M. Bhagalpur University","Bhagalpur","","Bihar","2(f) & 12(B)"
"430","State","Tamil Nadu Fisheries University","Vettar River View Campus, NagapattinamNagapattinam","611002","Tamil Nadu","2(f) & 12(B)"
"431","State","Tamil Nadu Open University","No. 577, Anna Salai,Saidapet,Chennai","600015","Tamil Nadu","2(f) & 12(B)"
"432","State","Tamil Nadu Physical Education and Sports University","Melakottaiyur, ChennaiSampat Maaligai, college Road,Chennai-600006","600127","Tamil Nadu","2(f)"
"433","State","Tamil Nadu Teacher Education University","Gangaiamman koil street, Karapakkam, Chennai,","600097","Tamil Nadu","2(f) & 12(B)"
"434","State","Tamil University","Trichy Road, Thanjavur,PIN - 613 005. (T.N.)","","Tamil Nadu","2(f) & 12(B)"
"435","State","Tamilnadu Agricultural University","Lawley Road, Coimbatore 641003, Tamilnadu","641003","Tamil Nadu","2(f) & 12(B)"
"436","State","Tamilnadu Dr. Ambedkar Law University","Poompozhil,5.Dr.D.G.S. dinakaranSalai, Raja Annamalai Puram,Chennai-600028, (T.N.)","","Tamil Nadu","2(f) & 12(B)"
"437","State","Tamilnadu Dr. M.G.R.Medical University","NO.69, ANNA SALAI, GUINDY, CHENNAI -600 032Chennai- 600 032.","600032","Tamil Nadu","2(f) & 12(B)"
"438","State","Tamilnadu National Law University","Navalur Kuttapattu,Srirangam Taluk,Tiruchirapalli","620 009","Tamil Nadu","2(f) & 12(B)"
"439","State","Tamilnadu Veterinary & Animal Sciences University","Tamil Nadu Veterinary and Animal Sciences University, Madhavaram Milk Colony, Chennai-51, Tamil Nadu","600051","Tamil Nadu","2(f) & 12(B)"
"440","State","Telangana University","Vil: Nadpally, Suddapally, Mdl: Dichpally, Dist.: NizamabadNizamabad- 503 322Andhra Pradesh","503322","Telangana","2(f) & 12(B)"
"441","State","The Bengal Engineering & Science University","ShibpurHowrah","","West Bengal","2(f)"
"442","State","The Maharaja Bhupinder Singh Punjab Sports University","Mohindra Kothi, Near Fountain Chowk, Patiala","147001","Punjab","2(f)"
"443","State","The National Law University of Meghalaya","Mayurbhanj Complex, Nongthymmai, Shillong","793014","Meghalaya","2(f)"
"444","State","The Rajiv Gandhi National University of Law","Sidhuwal, Bhadson Road, Patiala","147006","Punjab","2(f) & 12(B)"
"445","State","The Sanskrit College and University","Bankim Chaterjee StreetKolkata","700073","West Bengal","2(f)"
"446","State","The Tamil Nadu Dr.J Jayalalithaa Music and Fine Arts University","Dr. D.G.S. Dinakaran SalaiChennai","600028","Tamil Nadu","2(f)"
"447","State","The West Bengal National University of Juridical Science","Aranya Bhavan,10A LA Blk.,S.L City,Calcutta","","West Bengal","2(f) & 12(B)"
"448","State","The West Bengal University of Health Sciences","DD-36, Secotor-1 Salt LakeKolkata","700064","West Bengal","2(f) & 12(B)"
"449","State","Thiruvalluvar University","Serkkadu, VelloreVellore DistrictTamil Nadu","632 115","Tamil Nadu","2(f) & 12(B)"
"450","State","Thunchath Ezhuthachan Malayalam University","Vakad po, Vakad, Tirur, Malappuram DistrictVakkad PO,  Tirur,Malappuram","676502","Kerala","2(f) & 12(B)"
"451","State","Tumkur University","Tumkur University B H Road, Tumkur, Karnataka, IndiaB.H. Road, Tumkur","572103","Karnataka","2(f) & 12(B)"
"452","State","U.P. Pandit Deen Dayal Upadhyaya Pashu Chikitsa Vigyan Vishwavidhyalaya Evam Go-Anusandhan Sansthan","College of Veterinary Science and Animal Husbandry, DUVASU, MathuraUttar Pradesh","281001","Uttar Pradesh","2(f)"
"453","State","U.P. Rajarshi Tandon Open University","Shantipuram (Sector-F), Phaphamau, Prayagraj, Uttar Pradesh.(Sector-F)PhaphamauAllahabad-211013","211013","Uttar Pradesh","2(f)"
"454","State","U.P.King George's University of Dental Sciences","Lucknow","","Uttar Pradesh","2(f)"
"455","State","University of Agricultural Sciences","Lingasuguru Road,Raichur","584104","Karnataka","2(f) & 12(B)"
"456","State","University of Agricultural Sciences Banglore","GKVK -Campus,Bangalore","560 024","Karnataka","2(f) & 12(B)"
"457","State","University of Agricultural Sciences Dharwad","University of Agricultural Sciences, Dharwad (Karnataka)Dharwad","580005","Karnataka","2(f) & 12(B)"
"458","State","University of Gour Banga","Post Office - Mokdumpur, District - Malda,  West Bengal, Pin Code - 732103Distt. Malda","732103","West Bengal","2(f) & 12(B)"
"459","State","University of Horticultural Sciences","NEAR SEMIKERI CROSS, UDYANAGIRI, NAVANAGAR, BAGALKOTNear Seemikeri Cross,Bagalkot","587104","Karnataka","2(f)"
"460","State","University of Kota","Swami Vivekananda Nagar, Kota","324005","Rajasthan","2(f) & 12(B)"
"461","State","University of Ladakh","Melongthang, Leh-Ladakh near FRL, Leh","194101","Ladakh","2(f)"
"462","State","University of Lucknow","Babuganj,Hasanganj,Lucknow","226007","Uttar Pradesh","2(f) & 12(B)"
"463","State","University of North Bengal","PO: North Bengal University, Dist: Darjeeling, West BengalPO North Bengal University,District Darjeeling","734013","West Bengal","2(f) & 12(B)"
"464","State","University of Visvesvaraya College of Engineering","K. R. Circle, Dr Ambedkar Veedhi, Bengaluru","560001","Karnataka","2(f)"
"465","State","Utkal University","Vani Vihar, Bhubaneshwar","751 004","Odisha","2(f) & 12(B)"
"466","State","Utkal University of Culture","SANSKRUTI VIHAR, MADANPUR, Bhubaneswar","752054","Odisha","2(f)"
"467","State","Uttar Banga Krishi Vishwavidyalaya","P.O. Pundibari, Dist. Coochbehar, PIN- 736165Cooch Behar, West Bengal-736165","736165","West Bengal","2(f)"
"468","State","Uttar Pradesh University of Medical Sciences","Saifai,Etawah","206130","Uttar Pradesh","2(f)"
"469","State","Uttarakhand Ayurved University","Railway Road, Harrawala, DehradunRajpur RoadDehradun","248001","Uttarakhand","2(f)"
"470","State","Uttarakhand Open University","Teenpani Bypass, Rampur Road, HaldwaniPost Office:- Industrial EstateHaldwani (Nainital)","263139","Uttarakhand","2(f)"
"471","State","Uttarakhand Sanskrit University","NH-58, BHEL More,  Haridwar-Delhi National Highway,P.O. BahadarabadHaridwar","249 402","Uttarakhand","2(f)"
"472","State","Uttarakhand Technical University","Uttarakhand Technical University,Suddhowal post office chandan wadi,dehradun Uttarkhandwala, Dehrdun","248007","Uttarakhand","2(f)"
"473","State","Vardhman Mahaveer Open University","Rawatbhata Road, KotaRAJASTHAN","324021","Rajasthan","2(f) & 12(B)"
"474","State","Veer Bahadur Singh Purvanchal University","Shahganj Road, JaunpurPIN-222002   (U.P.)","","Uttar Pradesh","2(f) & 12(B)"
"475","State","Veer Chandra Singh Garhwali Uttarakhand University of Horticulture & Forestry","VCSG Uttarakhand University of Horticulture & Forestry, Bharsar, Pauri Garhwal , UttarakhandUttrakhand","246123","Uttarakhand","2(f)"
"476","State","Veer Kunwar Singh University","Ara","802301","Bihar","2(f) & 12(B)"
"477","State","Veer Narmad South Gujarat University","Udhna-Magdalla Road, Surat","395007","Gujarat","2(f) & 12(B)"
"478","State","Veer Surendra Sai Institute of Medical Science and Research","Ayuvihar, Burla, Sambalpur","768017","Odisha","2(f) & 12(B)"
"479","State","Veer Surendra Sai University of Technology","Siddhi Vihar, Burla,  Dist. Sambalpur","768018","Odisha","2(f) & 12(B)"
"480","State","Vesveswaraiah Technological University","Jnana Sangama,Belgaum","590018","Karnataka","2(f) & 12(B)"
"481","State","Vidya Sagar University","PO. -Vidyasagar UniversityMidnapore-721102,Dist.-paschim Mediripur, (W.B.)","","West Bengal","2(f) & 12(B)"
"482","State","Vijayanagara Sri Krishnadevaraya University","BallariVinayaka Nagar,Contonment,Bellary","583105","Karnataka","2(f) & 12(B)"
"483","State","Vikram University","Ujjain,","456 010","Madhya Pradesh","2(f) & 12(B)"
"484","State","Vikrama Simhapuri University","kakutur,Venkatachalam (M.D.),Nellore","524324","Andhra Pradesh","2(f) & 12(B)"
"485","State","Vinoba Bhave University","Hazaribagh,PIN - 825 301. (JHARKHAND)Post Box No.-31","","Jharkhand","2(f) & 12(B)"
"486","State","Vishvakarma Skills University","Jawahar Lal Nehru Marg, Mahesh Nagar Phatak, Tilak Nagar, Jaipur","302015","Rajasthan","2(f)"
"487","State","West Bengal State University","Berunanpukuria,Malikapur,Barasat, 24 Parganas(North),Kolkata - 700126Building 10knc, Kolkata-700124","700126","West Bengal","2(f) & 12(B)"
"488","State","West Bengal University of Animal and Fishery Sciences","37 & 68, ksudiram Bose Sarani, Kolkata-700037","700037","West Bengal","2(f) & 12(B)"
"489","State","West Bengal University of Teachers, Training, Education Planning and Administration","25/2 & 25/3, Ballygunge Circular RoadKolkata","700019","West Bengal","2(f)"
"490","State","Yashwant Rao Chavan Maharashtra Open University","Dnyangangotri Near Gangapur Dam, Nashik,  Maharashtra(India)Gangapur Dam,Nasik-422222","422222","Maharashtra","2(f) & 12(B)"
"491","State","Yogi Vemana University","Vemana Puram,Yogi Vemana University Rd,Ganganapalle","516005","Andhra Pradesh","2(f) & 12(B)"
"492","State","Young India Skills University","ESCI Campus, Gachibowli, Hyderabad","600032","Telangana","2(f)"